17:34:04.018276 IP 192.168.122.1.60343 > 192.168.122.239.9801: Flags [S], seq 560438475, win 29200, options [mss 1460,sackOK,TS val 413242348 ecr 0,nop,wscale 7], length 0
17:34:04.018306 IP 192.168.122.239.9801 > 192.168.122.1.60343: Flags [S.], seq 427075314, ack 560438476, win 28960, options [mss 1460,sackOK,TS val 4184926363 ecr 413242348,nop,wscale 7], length 0
17:34:04.018414 IP 192.168.122.1.60343 > 192.168.122.239.9801: Flags [.], ack 427075315, win 229, options [nop,nop,TS val 413242348 ecr 4184926363], length 0
17:34:04.018468 IP 192.168.122.1.60343 > 192.168.122.239.9801: Flags [P.], seq 560438476:560438500, ack 427075315, win 229, options [nop,nop,TS val 413242348 ecr 4184926363], length 24
17:34:04.018480 IP 192.168.122.239.9801 > 192.168.122.1.60343: Flags [.], ack 560438500, win 227, options [nop,nop,TS val 4184926363 ecr 413242348], length 0
17:34:04.018493 IP 192.168.122.1.60343 > 192.168.122.239.9801: Flags [.], seq 560438500:560451532, ack 427075315, win 229, options [nop,nop,TS val 413242348 ecr 4184926363], length 13032
17:34:04.018501 IP 192.168.122.239.9801 > 192.168.122.1.60343: Flags [.], ack 560451532, win 430, options [nop,nop,TS val 4184926363 ecr 413242348], length 0
17:34:04.029769 IP 192.168.122.1.60343 > 192.168.122.239.9801: Flags [.], seq 560466012:560467460, ack 427075315, win 229, options [nop,nop,TS val 413242351 ecr 4184926363], length 1448
17:34:04.029801 IP 192.168.122.239.9801 > 192.168.122.1.60343: Flags [.], ack 560451532, win 453, options [nop,nop,TS val 4184926366 ecr 413242348,nop,nop,sack 1 {560466012:560467460}], length 0
17:34:04.029894 IP 192.168.122.1.60343 > 192.168.122.239.9801: Flags [.], seq 560451532:560454428, ack 427075315, win 229, options [nop,nop,TS val 413242351 ecr 4184926366], length 2896
17:34:04.029922 IP 192.168.122.239.9801 > 192.168.122.1.60343: Flags [.], ack 560454428, win 498, options [nop,nop,TS val 4184926366 ecr 413242351,nop,nop,sack 1 {560466012:560467460}], length 0
17:34:04.030020 IP 192.168.122.1.60343 > 192.168.122.239.9801: Flags [.], seq 560438476:560438500, ack 427075315, win 229, options [nop,nop,TS val 413242351 ecr 4184926366], length 24
17:34:04.030048 IP 192.168.122.239.9801 > 192.168.122.1.60343: Flags [.], ack 560458772, win 566, options [nop,nop,TS val 4184926366 ecr 413242351,nop,nop,sack 1 {560466012:560467460}], length 0
