16:04:14.209487 IP 192.168.122.1.41209 > 192.168.122.239.8080: Flags [S], seq 1297536514, win 29200, options [mss 1460,sackOK,TS val 541496790 ecr 0,nop,wscale 7], length 0
16:04:14.259711 IP 192.168.122.239.8080 > 192.168.122.1.41209: Flags [S.], seq 1877169332, ack 1297536515, win 28960, options [mss 1460,sackOK,TS val 932159047 ecr 541496790,nop,wscale 7], length 0
16:04:14.259915 IP 192.168.122.1.41209 > 192.168.122.239.8080: Flags [.], ack 1877169333, win 229, options [nop,nop,TS val 541496802 ecr 932159047], length 0
16:04:14.270508 IP 192.168.122.1.41209 > 192.168.122.239.8080: Flags [.], seq 1297536515:1297539411, ack 1877169333, win 229, options [nop,nop,TS val 541496805 ecr 932159047], length 2896
16:04:14.270528 IP 192.168.122.1.41209 > 192.168.122.239.8080: Flags [P.], seq 1297539411:1297540611, ack 1877169333, win 229, options [nop,nop,TS val 541496805 ecr 932159047], length 1200
16:04:14.270532 IP 192.168.122.1.41209 > 192.168.122.239.8080: Flags [.], seq 1297540611:1297543507, ack 1877169333, win 229, options [nop,nop,TS val 541496805 ecr 932159047], length 2896
16:04:14.270537 IP 192.168.122.1.41209 > 192.168.122.239.8080: Flags [.], seq 1297543507:1297546403, ack 1877169333, win 229, options [nop,nop,TS val 541496805 ecr 932159047], length 2896
16:04:14.270542 IP 192.168.122.1.41209 > 192.168.122.239.8080: Flags [.], seq 1297546403:1297547851, ack 1877169333, win 229, options [nop,nop,TS val 541496805 ecr 932159047], length 1448
16:04:14.270565 IP 192.168.122.1.41209 > 192.168.122.239.8080: Flags [.], seq 1297547851:1297550747, ack 1877169333, win 229, options [nop,nop,TS val 541496805 ecr 932159047], length 2896
16:04:14.320561 IP 192.168.122.239.8080 > 192.168.122.1.41209: Flags [.], ack 1297539411, win 272, options [nop,nop,TS val 932159062 ecr 541496805], length 0
16:04:14.320579 IP 192.168.122.239.8080 > 192.168.122.1.41209: Flags [.], ack 1297540611, win 295, options [nop,nop,TS val 932159062 ecr 541496805], length 0
16:04:14.320587 IP 192.168.122.239.8080 > 192.168.122.1.41209: Flags [.], ack 1297543507, win 340, options [nop,nop,TS val 932159062 ecr 541496805], length 0
16:04:14.320594 IP 192.168.122.239.8080 > 192.168.122.1.41209: Flags [.], ack 1297546403, win 385, options [nop,nop,TS val 932159062 ecr 541496805], length 0
16:04:14.320601 IP 192.168.122.239.8080 > 192.168.122.1.41209: Flags [.], ack 1297547851, win 408, options [nop,nop,TS val 932159062 ecr 541496805], length 0
16:04:14.320609 IP 192.168.122.239.8080 > 192.168.122.1.41209: Flags [.], ack 1297550747, win 453, options [nop,nop,TS val 932159062 ecr 541496805], length 0
16:04:14.320639 IP 192.168.122.1.41209 > 192.168.122.239.8080: Flags [.], seq 1297550747:1297553643, ack 1877169333, win 229, options [nop,nop,TS val 541496818 ecr 932159062], length 2896
16:04:14.320657 IP 192.168.122.239.8080 > 192.168.122.1.41209: Flags [P.], seq 1877169333:1877171637, ack 1297550747, win 453, options [nop,nop,TS val 932159062 ecr 541496805], length 2304
16:04:14.320685 IP 192.168.122.239.8080 > 192.168.122.1.41209: Flags [.], seq 1877171637:1877173085, ack 1297550747, win 453, options [nop,nop,TS val 932159062 ecr 541496805], length 1448
16:04:14.320685 IP 192.168.122.1.41209 > 192.168.122.239.8080: Flags [.], seq 1297553643:1297556539, ack 1877169333, win 229, options [nop,nop,TS val 541496818 ecr 932159062], length 2896
16:04:14.320687 IP 192.168.122.239.8080 > 192.168.122.1.41209: Flags [.], seq 1877173085:1877175981, ack 1297550747, win 453, options [nop,nop,TS val 932159062 ecr 541496805], length 2896
16:04:14.320687 IP 192.168.122.1.41209 > 192.168.122.239.8080: Flags [.], seq 1297556539:1297559435, ack 1877169333, win 229, options [nop,nop,TS val 541496818 ecr 932159062], length 2896
16:04:14.320689 IP 192.168.122.1.41209 > 192.168.122.239.8080: Flags [.], seq 1297559435:1297562331, ack 1877169333, win 229, options [nop,nop,TS val 541496818 ecr 932159062], length 2896
16:04:14.320690 IP 192.168.122.1.41209 > 192.168.122.239.8080: Flags [.], seq 1297562331:1297565227, ack 1877169333, win 229, options [nop,nop,TS val 541496818 ecr 932159062], length 2896
16:04:14.320715 IP 192.168.122.1.41209 > 192.168.122.239.8080: Flags [.], ack 1877171637, win 265, options [nop,nop,TS val 541496818 ecr 932159062], length 0
16:04:14.320722 IP 192.168.122.239.8080 > 192.168.122.1.41209: Flags [.], seq 1877175981:1877177429, ack 1297550747, win 453, options [nop,nop,TS val 932159062 ecr 541496805], length 1448
16:04:14.320738 IP 192.168.122.239.8080 > 192.168.122.1.41209: Flags [.], seq 1877177429:1877180325, ack 1297550747, win 453, options [nop,nop,TS val 932159062 ecr 541496805], length 2896
16:04:14.320744 IP 192.168.122.1.41209 > 192.168.122.239.8080: Flags [.], ack 1877173085, win 287, options [nop,nop,TS val 541496818 ecr 932159062], length 0
16:04:14.320757 IP 192.168.122.1.41209 > 192.168.122.239.8080: Flags [.], ack 1877175981, win 332, options [nop,nop,TS val 541496818 ecr 932159062], length 0
16:04:14.320772 IP 192.168.122.239.8080 > 192.168.122.1.41209: Flags [.], seq 1877180325:1877181773, ack 1297550747, win 453, options [nop,nop,TS val 932159062 ecr 541496805], length 1448
16:04:14.320779 IP 192.168.122.239.8080 > 192.168.122.1.41209: Flags [.], seq 1877181773:1877183221, ack 1297550747, win 453, options [nop,nop,TS val 932159062 ecr 541496805], length 1448
16:04:14.320803 IP 192.168.122.1.41209 > 192.168.122.239.8080: Flags [.], ack 1877177429, win 355, options [nop,nop,TS val 541496818 ecr 932159062], length 0
16:04:14.320805 IP 192.168.122.1.41209 > 192.168.122.239.8080: Flags [.], ack 1877180325, win 400, options [nop,nop,TS val 541496818 ecr 932159062], length 0
16:04:14.320806 IP 192.168.122.1.41209 > 192.168.122.239.8080: Flags [.], ack 1877181773, win 423, options [nop,nop,TS val 541496818 ecr 932159062], length 0
16:04:14.320808 IP 192.168.122.1.41209 > 192.168.122.239.8080: Flags [.], ack 1877183221, win 446, options [nop,nop,TS val 541496818 ecr 932159062], length 0
16:04:14.370672 IP 192.168.122.239.8080 > 192.168.122.1.41209: Flags [.], ack 1297553643, win 498, options [nop,nop,TS val 932159074 ecr 541496818], length 0
16:04:14.370703 IP 192.168.122.239.8080 > 192.168.122.1.41209: Flags [.], ack 1297556539, win 543, options [nop,nop,TS val 932159074 ecr 541496818], length 0
16:04:14.370704 IP 192.168.122.239.8080 > 192.168.122.1.41209: Flags [.], ack 1297556539, win 589, options [nop,nop,TS val 932159074 ecr 541496818,nop,nop,sack 1 {1297559435:1297562331}], length 0
16:04:14.370705 IP 192.168.122.239.8080 > 192.168.122.1.41209: Flags [.], ack 1297556539, win 634, options [nop,nop,TS val 932159074 ecr 541496818,nop,nop,sack 1 {1297559435:1297565227}], length 0
16:04:14.370731 IP 192.168.122.239.8080 > 192.168.122.1.41209: Flags [.], seq 1877183221:1877186093, ack 1297556539, win 634, options [nop,nop,TS val 932159074 ecr 541496818,nop,nop,sack 1 {1297559435:1297565227}], length 2872
16:04:14.370739 IP 192.168.122.1.41209 > 192.168.122.239.8080: Flags [.], seq 1297565227:1297568123, ack 1877183221, win 446, options [nop,nop,TS val 541496830 ecr 932159074], length 2896
16:04:14.370750 IP 192.168.122.239.8080 > 192.168.122.1.41209: Flags [.], seq 1877186093:1877188965, ack 1297556539, win 634, options [nop,nop,TS val 932159074 ecr 541496818,nop,nop,sack 1 {1297559435:1297565227}], length 2872
16:04:14.370754 IP 192.168.122.1.41209 > 192.168.122.239.8080: Flags [.], seq 1297568123:1297571019, ack 1877183221, win 446, options [nop,nop,TS val 541496830 ecr 932159074], length 2896
16:04:14.370758 IP 192.168.122.1.41209 > 192.168.122.239.8080: Flags [.], seq 1297556539:1297559435, ack 1877183221, win 446, options [nop,nop,TS val 541496830 ecr 932159074], length 2896
16:04:14.370759 IP 192.168.122.1.41209 > 192.168.122.239.8080: Flags [.], seq 1297571019:1297572467, ack 1877183221, win 446, options [nop,nop,TS val 541496830 ecr 932159074], length 1448
16:04:14.370761 IP 192.168.122.1.41209 > 192.168.122.239.8080: Flags [.], ack 1877186093, win 490, options [nop,nop,TS val 541496830 ecr 932159074], length 0
16:04:14.370762 IP 192.168.122.1.41209 > 192.168.122.239.8080: Flags [.], ack 1877188965, win 535, options [nop,nop,TS val 541496830 ecr 932159074], length 0
16:04:14.370789 IP 192.168.122.239.8080 > 192.168.122.1.41209: Flags [.], seq 1877188965:1877191837, ack 1297556539, win 634, options [nop,nop,TS val 932159074 ecr 541496818,nop,nop,sack 1 {1297559435:1297565227}], length 2872
16:04:14.370812 IP 192.168.122.239.8080 > 192.168.122.1.41209: Flags [P.], seq 1877191837:1877191860, ack 1297556539, win 634, options [nop,nop,TS val 932159074 ecr 541496818,nop,nop,sack 1 {1297559435:1297565227}], length 23
16:04:14.370880 IP 192.168.122.1.41209 > 192.168.122.239.8080: Flags [.], ack 1877191837, win 580, options [nop,nop,TS val 541496830 ecr 932159074], length 0
16:04:14.370886 IP 192.168.122.1.41209 > 192.168.122.239.8080: Flags [.], ack 1877191860, win 580, options [nop,nop,TS val 541496830 ecr 932159074], length 0
16:04:14.420771 IP 192.168.122.239.8080 > 192.168.122.1.41209: Flags [.], ack 1297556539, win 679, options [nop,nop,TS val 932159087 ecr 541496818,nop,nop,sack 1 {1297559435:1297568123}], length 0
16:04:14.420778 IP 192.168.122.239.8080 > 192.168.122.1.41209: Flags [.], ack 1297556539, win 724, options [nop,nop,TS val 932159087 ecr 541496818,nop,nop,sack 1 {1297559435:1297571019}], length 0
16:04:14.420778 IP 192.168.122.239.8080 > 192.168.122.1.41209: Flags [.], ack 1297556539, win 747, options [nop,nop,TS val 932159087 ecr 541496818,nop,nop,sack 1 {1297559435:1297572467}], length 0
16:04:14.420859 IP 192.168.122.1.41209 > 192.168.122.239.8080: Flags [.], seq 1297572467:1297578259, ack 1877191860, win 580, options [nop,nop,TS val 541496843 ecr 932159087], length 5792
16:04:14.420878 IP 192.168.122.1.41209 > 192.168.122.239.8080: Flags [.], seq 1297556539:1297559435, ack 1877191860, win 580, options [nop,nop,TS val 541496843 ecr 932159087], length 2896
16:04:14.420881 IP 192.168.122.1.41209 > 192.168.122.239.8080: Flags [.], seq 1297578259:1297579707, ack 1877191860, win 580, options [nop,nop,TS val 541496843 ecr 932159087], length 1448
16:04:14.470908 IP 192.168.122.239.8080 > 192.168.122.1.41209: Flags [.], ack 1297556539, win 838, options [nop,nop,TS val 932159099 ecr 541496818,nop,nop,sack 1 {1297559435:1297578259}], length 0
16:04:14.470916 IP 192.168.122.239.8080 > 192.168.122.1.41209: Flags [.], ack 1297578259, win 883, options [nop,nop,TS val 932159099 ecr 541496843], length 0
16:04:14.470917 IP 192.168.122.239.8080 > 192.168.122.1.41209: Flags [.], ack 1297579707, win 905, options [nop,nop,TS val 932159099 ecr 541496843], length 0
16:04:14.470918 IP 192.168.122.239.8080 > 192.168.122.1.41209: Flags [P.], seq 1877191860:1877194164, ack 1297579707, win 905, options [nop,nop,TS val 932159099 ecr 541496843], length 2304
16:04:14.470930 IP 192.168.122.239.8080 > 192.168.122.1.41209: Flags [.], seq 1877194164:1877195612, ack 1297579707, win 905, options [nop,nop,TS val 932159099 ecr 541496843], length 1448
16:04:14.470949 IP 192.168.122.239.8080 > 192.168.122.1.41209: Flags [.], seq 1877195612:1877198508, ack 1297579707, win 905, options [nop,nop,TS val 932159099 ecr 541496843], length 2896
16:04:14.470982 IP 192.168.122.239.8080 > 192.168.122.1.41209: Flags [.], seq 1877198508:1877199956, ack 1297579707, win 905, options [nop,nop,TS val 932159099 ecr 541496843], length 1448
16:04:14.470993 IP 192.168.122.1.41209 > 192.168.122.239.8080: Flags [.], seq 1297579707:1297582603, ack 1877191860, win 580, options [nop,nop,TS val 541496855 ecr 932159099], length 2896
16:04:14.471001 IP 192.168.122.239.8080 > 192.168.122.1.41209: Flags [.], seq 1877199956:1877202852, ack 1297579707, win 905, options [nop,nop,TS val 932159099 ecr 541496843], length 2896
16:04:14.471007 IP 192.168.122.1.41209 > 192.168.122.239.8080: Flags [.], seq 1297582603:1297585499, ack 1877191860, win 580, options [nop,nop,TS val 541496855 ecr 932159099], length 2896
16:04:14.471010 IP 192.168.122.1.41209 > 192.168.122.239.8080: Flags [.], seq 1297585499:1297588395, ack 1877191860, win 580, options [nop,nop,TS val 541496855 ecr 932159099], length 2896
16:04:14.471011 IP 192.168.122.1.41209 > 192.168.122.239.8080: Flags [.], seq 1297588395:1297591291, ack 1877191860, win 580, options [nop,nop,TS val 541496855 ecr 932159099], length 2896
16:04:14.471012 IP 192.168.122.1.41209 > 192.168.122.239.8080: Flags [.], ack 1877194164, win 616, options [nop,nop,TS val 541496855 ecr 932159099], length 0
16:04:14.471014 IP 192.168.122.1.41209 > 192.168.122.239.8080: Flags [.], ack 1877195612, win 639, options [nop,nop,TS val 541496855 ecr 932159099], length 0
16:04:14.471015 IP 192.168.122.1.41209 > 192.168.122.239.8080: Flags [.], ack 1877198508, win 684, options [nop,nop,TS val 541496855 ecr 932159099], length 0
16:04:14.471015 IP 192.168.122.1.41209 > 192.168.122.239.8080: Flags [.], ack 1877199956, win 707, options [nop,nop,TS val 541496855 ecr 932159099], length 0
16:04:14.471016 IP 192.168.122.1.41209 > 192.168.122.239.8080: Flags [.], ack 1877202852, win 752, options [nop,nop,TS val 541496855 ecr 932159099], length 0
16:04:14.471023 IP 192.168.122.239.8080 > 192.168.122.1.41209: Flags [.], seq 1877202852:1877204300, ack 1297579707, win 905, options [nop,nop,TS val 932159099 ecr 541496843], length 1448
16:04:14.471042 IP 192.168.122.239.8080 > 192.168.122.1.41209: Flags [.], seq 1877204300:1877207196, ack 1297579707, win 905, options [nop,nop,TS val 932159099 ecr 541496843], length 2896
16:04:14.471063 IP 192.168.122.239.8080 > 192.168.122.1.41209: Flags [.], seq 1877207196:1877210092, ack 1297579707, win 905, options [nop,nop,TS val 932159099 ecr 541496843], length 2896
16:04:14.471110 IP 192.168.122.239.8080 > 192.168.122.1.41209: Flags [.], seq 1877210092:1877211540, ack 1297579707, win 905, options [nop,nop,TS val 932159099 ecr 541496843], length 1448
16:04:14.471118 IP 192.168.122.239.8080 > 192.168.122.1.41209: Flags [.], seq 1877211540:1877214436, ack 1297579707, win 905, options [nop,nop,TS val 932159099 ecr 541496843], length 2896
16:04:14.471121 IP 192.168.122.1.41209 > 192.168.122.239.8080: Flags [.], ack 1877204300, win 775, options [nop,nop,TS val 541496855 ecr 932159099], length 0
16:04:14.471127 IP 192.168.122.1.41209 > 192.168.122.239.8080: Flags [.], ack 1877207196, win 820, options [nop,nop,TS val 541496855 ecr 932159099], length 0
16:04:14.471129 IP 192.168.122.1.41209 > 192.168.122.239.8080: Flags [.], ack 1877210092, win 865, options [nop,nop,TS val 541496855 ecr 932159099], length 0
16:04:14.471131 IP 192.168.122.1.41209 > 192.168.122.239.8080: Flags [.], ack 1877211540, win 888, options [nop,nop,TS val 541496855 ecr 932159099], length 0
16:04:14.471132 IP 192.168.122.1.41209 > 192.168.122.239.8080: Flags [.], ack 1877214436, win 933, options [nop,nop,TS val 541496855 ecr 932159099], length 0
16:04:14.471144 IP 192.168.122.239.8080 > 192.168.122.1.41209: Flags [.], seq 1877214436:1877215884, ack 1297579707, win 905, options [nop,nop,TS val 932159099 ecr 541496843], length 1448
16:04:14.471168 IP 192.168.122.239.8080 > 192.168.122.1.41209: Flags [.], seq 1877215884:1877217332, ack 1297579707, win 905, options [nop,nop,TS val 932159099 ecr 541496843], length 1448
16:04:14.471194 IP 192.168.122.1.41209 > 192.168.122.239.8080: Flags [.], ack 1877215884, win 956, options [nop,nop,TS val 541496855 ecr 932159099], length 0
16:04:14.471200 IP 192.168.122.1.41209 > 192.168.122.239.8080: Flags [.], ack 1877217332, win 978, options [nop,nop,TS val 541496855 ecr 932159099], length 0
16:04:14.521005 IP 192.168.122.239.8080 > 192.168.122.1.41209: Flags [.], ack 1297582603, win 951, options [nop,nop,TS val 932159112 ecr 541496855], length 0
16:04:14.521016 IP 192.168.122.239.8080 > 192.168.122.1.41209: Flags [.], ack 1297585499, win 996, options [nop,nop,TS val 932159112 ecr 541496855], length 0
16:04:14.521017 IP 192.168.122.239.8080 > 192.168.122.1.41209: Flags [P.], seq 1877217332:1877220228, ack 1297585499, win 996, options [nop,nop,TS val 932159112 ecr 541496855], length 2896
16:04:14.521035 IP 192.168.122.239.8080 > 192.168.122.1.41209: Flags [.], ack 1297588395, win 1041, options [nop,nop,TS val 932159112 ecr 541496855], length 0
16:04:14.521036 IP 192.168.122.239.8080 > 192.168.122.1.41209: Flags [P.], seq 1877220228:1877222532, ack 1297588395, win 1041, options [nop,nop,TS val 932159112 ecr 541496855], length 2304
16:04:14.521071 IP 192.168.122.239.8080 > 192.168.122.1.41209: Flags [.], seq 1877222532:1877223980, ack 1297588395, win 1041, options [nop,nop,TS val 932159112 ecr 541496855], length 1448
16:04:14.521078 IP 192.168.122.239.8080 > 192.168.122.1.41209: Flags [.], seq 1877223980:1877226876, ack 1297588395, win 1041, options [nop,nop,TS val 932159112 ecr 541496855], length 2896
16:04:14.521079 IP 192.168.122.1.41209 > 192.168.122.239.8080: Flags [.], seq 1297591291:1297594187, ack 1877217332, win 978, options [nop,nop,TS val 541496868 ecr 932159112], length 2896
16:04:14.521093 IP 192.168.122.1.41209 > 192.168.122.239.8080: Flags [.], seq 1297594187:1297597083, ack 1877217332, win 978, options [nop,nop,TS val 541496868 ecr 932159112], length 2896
16:04:14.521095 IP 192.168.122.1.41209 > 192.168.122.239.8080: Flags [.], ack 1877220228, win 1023, options [nop,nop,TS val 541496868 ecr 932159112], length 0
16:04:14.521095 IP 192.168.122.1.41209 > 192.168.122.239.8080: Flags [.], seq 1297597083:1297599979, ack 1877220228, win 1023, options [nop,nop,TS val 541496868 ecr 932159112], length 2896
16:04:14.521096 IP 192.168.122.1.41209 > 192.168.122.239.8080: Flags [.], ack 1877222532, win 1059, options [nop,nop,TS val 541496868 ecr 932159112], length 0
16:04:14.521104 IP 192.168.122.1.41209 > 192.168.122.239.8080: Flags [.], ack 1877226876, win 1127, options [nop,nop,TS val 541496868 ecr 932159112], length 0
16:04:14.571104 IP 192.168.122.239.8080 > 192.168.122.1.41209: Flags [.], ack 1297588395, win 1086, options [nop,nop,TS val 932159124 ecr 541496855,nop,nop,sack 1 {1297591291:1297594187}], length 0
16:04:14.571115 IP 192.168.122.239.8080 > 192.168.122.1.41209: Flags [.], ack 1297588395, win 1132, options [nop,nop,TS val 932159124 ecr 541496855,nop,nop,sack 1 {1297591291:1297597083}], length 0
16:04:14.571116 IP 192.168.122.239.8080 > 192.168.122.1.41209: Flags [.], ack 1297588395, win 1177, options [nop,nop,TS val 932159124 ecr 541496855,nop,nop,sack 1 {1297591291:1297599979}], length 0
16:04:14.571117 IP 192.168.122.239.8080 > 192.168.122.1.41209: Flags [P.], seq 1877226876:1877227698, ack 1297588395, win 1177, options [nop,nop,TS val 932159124 ecr 541496855,nop,nop,sack 1 {1297591291:1297599979}], length 822
16:04:14.571180 IP 192.168.122.1.41209 > 192.168.122.239.8080: Flags [.], seq 1297588395:1297591291, ack 1877226876, win 1127, options [nop,nop,TS val 541496880 ecr 932159124], length 2896
16:04:14.571194 IP 192.168.122.1.41209 > 192.168.122.239.8080: Flags [P.], seq 1297599979:1297602875, ack 1877226876, win 1127, options [nop,nop,TS val 541496880 ecr 932159124], length 2896
16:04:14.571196 IP 192.168.122.1.41209 > 192.168.122.239.8080: Flags [.], seq 1297602875:1297604323, ack 1877226876, win 1127, options [nop,nop,TS val 541496880 ecr 932159124], length 1448
16:04:14.608004 IP 192.168.122.1.41209 > 192.168.122.239.8080: Flags [.], ack 1877227698, win 1150, options [nop,nop,TS val 541496890 ecr 932159124], length 0
16:04:14.621203 IP 192.168.122.239.8080 > 192.168.122.1.41209: Flags [.], ack 1297599979, win 1222, options [nop,nop,TS val 932159137 ecr 541496880], length 0
16:04:14.621208 IP 192.168.122.239.8080 > 192.168.122.1.41209: Flags [.], ack 1297602875, win 1267, options [nop,nop,TS val 932159137 ecr 541496880], length 0
16:04:14.621209 IP 192.168.122.239.8080 > 192.168.122.1.41209: Flags [.], ack 1297604323, win 1290, options [nop,nop,TS val 932159137 ecr 541496880], length 0
16:04:14.621209 IP 192.168.122.239.8080 > 192.168.122.1.41209: Flags [.], seq 1877227698:1877229146, ack 1297604323, win 1290, options [nop,nop,TS val 932159137 ecr 541496880], length 1448
16:04:14.621211 IP 192.168.122.239.8080 > 192.168.122.1.41209: Flags [.], seq 1877229146:1877232042, ack 1297604323, win 1290, options [nop,nop,TS val 932159137 ecr 541496880], length 2896
16:04:14.621248 IP 192.168.122.239.8080 > 192.168.122.1.41209: Flags [.], seq 1877232042:1877233490, ack 1297604323, win 1290, options [nop,nop,TS val 932159137 ecr 541496880], length 1448
16:04:14.621258 IP 192.168.122.239.8080 > 192.168.122.1.41209: Flags [.], seq 1877233490:1877236386, ack 1297604323, win 1290, options [nop,nop,TS val 932159137 ecr 541496880], length 2896
16:04:14.621292 IP 192.168.122.239.8080 > 192.168.122.1.41209: Flags [.], seq 1877236386:1877237834, ack 1297604323, win 1290, options [nop,nop,TS val 932159137 ecr 541496880], length 1448
16:04:14.621298 IP 192.168.122.1.41209 > 192.168.122.239.8080: Flags [.], seq 1297604323:1297605771, ack 1877227698, win 1150, options [nop,nop,TS val 541496893 ecr 932159137], length 1448
16:04:14.621303 IP 192.168.122.1.41209 > 192.168.122.239.8080: Flags [.], seq 1297605771:1297608667, ack 1877227698, win 1150, options [nop,nop,TS val 541496893 ecr 932159137], length 2896
16:04:14.621304 IP 192.168.122.1.41209 > 192.168.122.239.8080: Flags [.], seq 1297608667:1297611563, ack 1877227698, win 1150, options [nop,nop,TS val 541496893 ecr 932159137], length 2896
16:04:14.621306 IP 192.168.122.239.8080 > 192.168.122.1.41209: Flags [.], seq 1877237834:1877240730, ack 1297604323, win 1290, options [nop,nop,TS val 932159137 ecr 541496880], length 2896
16:04:14.621312 IP 192.168.122.1.41209 > 192.168.122.239.8080: Flags [.], ack 1877229146, win 1173, options [nop,nop,TS val 541496893 ecr 932159137], length 0
16:04:14.621313 IP 192.168.122.1.41209 > 192.168.122.239.8080: Flags [.], ack 1877232042, win 1218, options [nop,nop,TS val 541496893 ecr 932159137], length 0
16:04:14.621314 IP 192.168.122.1.41209 > 192.168.122.239.8080: Flags [.], ack 1877233490, win 1240, options [nop,nop,TS val 541496893 ecr 932159137], length 0
16:04:14.621315 IP 192.168.122.1.41209 > 192.168.122.239.8080: Flags [.], ack 1877236386, win 1286, options [nop,nop,TS val 541496893 ecr 932159137], length 0
16:04:14.621316 IP 192.168.122.1.41209 > 192.168.122.239.8080: Flags [.], ack 1877237834, win 1308, options [nop,nop,TS val 541496893 ecr 932159137], length 0
16:04:14.621317 IP 192.168.122.1.41209 > 192.168.122.239.8080: Flags [.], ack 1877240730, win 1354, options [nop,nop,TS val 541496893 ecr 932159137], length 0
16:04:14.621344 IP 192.168.122.239.8080 > 192.168.122.1.41209: Flags [.], seq 1877240730:1877243626, ack 1297604323, win 1290, options [nop,nop,TS val 932159137 ecr 541496880], length 2896
16:04:14.621365 IP 192.168.122.239.8080 > 192.168.122.1.41209: Flags [.], seq 1877243626:1877245074, ack 1297604323, win 1290, options [nop,nop,TS val 932159137 ecr 541496880], length 1448
16:04:14.658025 IP 192.168.122.239.8080 > 192.168.122.1.41209: Flags [P.], seq 1877245074:1877245617, ack 1297604323, win 1290, options [nop,nop,TS val 932159146 ecr 541496890], length 543
16:04:14.658094 IP 192.168.122.1.41209 > 192.168.122.239.8080: Flags [.], ack 1877245617, win 1337, options [nop,nop,TS val 541496902 ecr 932159137], length 0
16:04:14.671315 IP 192.168.122.239.8080 > 192.168.122.1.41209: Flags [.], ack 1297605771, win 1358, options [nop,nop,TS val 932159150 ecr 541496893,nop,nop,sack 1 {1297608667:1297611563}], length 0
16:04:14.671328 IP 192.168.122.239.8080 > 192.168.122.1.41209: Flags [.], seq 1877245617:1877247053, ack 1297605771, win 1358, options [nop,nop,TS val 932159150 ecr 541496893,nop,nop,sack 1 {1297608667:1297611563}], length 1436
16:04:14.671381 IP 192.168.122.1.41209 > 192.168.122.239.8080: Flags [.], seq 1297605771:1297607219, ack 1877245617, win 1337, options [nop,nop,TS val 541496905 ecr 932159150], length 1448
16:04:14.671394 IP 192.168.122.1.41209 > 192.168.122.239.8080: Flags [.], seq 1297611563:1297614459, ack 1877245617, win 1337, options [nop,nop,TS val 541496905 ecr 932159150], length 2896
16:04:14.708106 IP 192.168.122.239.8080 > 192.168.122.1.41209: Flags [P.], seq 1877247053:1877247246, ack 1297605771, win 1358, options [nop,nop,TS val 932159159 ecr 541496893,nop,nop,sack 1 {1297608667:1297611563}], length 193
16:04:14.708166 IP 192.168.122.1.41209 > 192.168.122.239.8080: Flags [.], ack 1877247246, win 1325, options [nop,nop,TS val 541496915 ecr 932159150], length 0
16:04:14.721401 IP 192.168.122.239.8080 > 192.168.122.1.41209: Flags [.], ack 1297607219, win 1381, options [nop,nop,TS val 932159162 ecr 541496905,nop,nop,sack 1 {1297608667:1297611563}], length 0
16:04:14.721405 IP 192.168.122.239.8080 > 192.168.122.1.41209: Flags [.], ack 1297607219, win 1425, options [nop,nop,TS val 932159162 ecr 541496905,nop,nop,sack 1 {1297608667:1297614459}], length 0
16:04:14.721405 IP 192.168.122.239.8080 > 192.168.122.1.41209: Flags [.], seq 1877247246:1877248682, ack 1297607219, win 1426, options [nop,nop,TS val 932159162 ecr 541496905,nop,nop,sack 1 {1297608667:1297614459}], length 1436
16:04:14.721471 IP 192.168.122.1.41209 > 192.168.122.239.8080: Flags [.], seq 1297614459:1297615907, ack 1877247246, win 1325, options [nop,nop,TS val 541496918 ecr 932159162], length 1448
16:04:14.721485 IP 192.168.122.1.41209 > 192.168.122.239.8080: Flags [.], seq 1297607219:1297608667, ack 1877247246, win 1325, options [nop,nop,TS val 541496918 ecr 932159162], length 1448
16:04:14.721492 IP 192.168.122.1.41209 > 192.168.122.239.8080: Flags [.], seq 1297615907:1297618803, ack 1877247246, win 1325, options [nop,nop,TS val 541496918 ecr 932159162], length 2896
16:04:14.758186 IP 192.168.122.239.8080 > 192.168.122.1.41209: Flags [P.], seq 1877248682:1877248875, ack 1297607219, win 1426, options [nop,nop,TS val 932159171 ecr 541496905,nop,nop,sack 1 {1297608667:1297614459}], length 193
16:04:14.771494 IP 192.168.122.239.8080 > 192.168.122.1.41209: Flags [.], ack 1297614459, win 1426, options [nop,nop,TS val 932159175 ecr 541496918], length 0
16:04:14.771497 IP 192.168.122.239.8080 > 192.168.122.1.41209: Flags [.], seq 1877248875:1877250323, ack 1297614459, win 1426, options [nop,nop,TS val 932159175 ecr 541496918], length 1448
16:04:14.771498 IP 192.168.122.239.8080 > 192.168.122.1.41209: Flags [.], ack 1297614459, win 1426, options [nop,nop,TS val 932159175 ecr 541496918,nop,nop,sack 1 {1297615907:1297618803}], length 0
16:04:14.771504 IP 192.168.122.239.8080 > 192.168.122.1.41209: Flags [.], seq 1877250323:1877253195, ack 1297614459, win 1426, options [nop,nop,TS val 932159175 ecr 541496918,nop,nop,sack 1 {1297615907:1297618803}], length 2872
16:04:14.771533 IP 192.168.122.239.8080 > 192.168.122.1.41209: Flags [.], seq 1877253195:1877254631, ack 1297614459, win 1426, options [nop,nop,TS val 932159175 ecr 541496918,nop,nop,sack 1 {1297615907:1297618803}], length 1436
16:04:14.771557 IP 192.168.122.239.8080 > 192.168.122.1.41209: Flags [.], seq 1877254631:1877256067, ack 1297614459, win 1446, options [nop,nop,TS val 932159175 ecr 541496918,nop,nop,sack 1 {1297615907:1297618803}], length 1436
16:04:14.771563 IP 192.168.122.1.41209 > 192.168.122.239.8080: Flags [P.], seq 1297618803:1297620251, ack 1877248875, win 1313, options [nop,nop,TS val 541496930 ecr 932159162], length 1448
16:04:14.771578 IP 192.168.122.1.41209 > 192.168.122.239.8080: Flags [P.], seq 1297620251:1297623147, ack 1877250323, win 1302, options [nop,nop,TS val 541496930 ecr 932159175], length 2896
16:04:14.771582 IP 192.168.122.1.41209 > 192.168.122.239.8080: Flags [.], ack 1877253195, win 1301, options [nop,nop,TS val 541496930 ecr 932159175], length 0
16:04:14.807985 IP 192.168.122.1.41209 > 192.168.122.239.8080: Flags [.], ack 1877256067, win 1286, options [nop,nop,TS val 541496940 ecr 932159175], length 0
16:04:14.821601 IP 192.168.122.239.8080 > 192.168.122.1.41209: Flags [P.], seq 1877256067:1877257020, ack 1297614459, win 1446, options [nop,nop,TS val 932159187 ecr 541496918,nop,nop,sack 1 {1297615907:1297620251}], length 953
16:04:14.821611 IP 192.168.122.239.8080 > 192.168.122.1.41209: Flags [.], ack 1297614459, win 1446, options [nop,nop,TS val 932159187 ecr 541496918,nop,nop,sack 1 {1297615907:1297623147}], length 0
16:04:14.821697 IP 192.168.122.1.41209 > 192.168.122.239.8080: Flags [.], seq 1297614459:1297615907, ack 1877256067, win 1286, options [nop,nop,TS val 541496943 ecr 932159187], length 1448
16:04:14.821724 IP 192.168.122.1.41209 > 192.168.122.239.8080: Flags [.], seq 1297623147:1297624595, ack 1877257020, win 1279, options [nop,nop,TS val 541496943 ecr 932159187], length 1448
16:04:14.871743 IP 192.168.122.239.8080 > 192.168.122.1.41209: Flags [.], ack 1297623147, win 1416, options [nop,nop,TS val 932159200 ecr 541496943], length 0
16:04:14.871750 IP 192.168.122.239.8080 > 192.168.122.1.41209: Flags [.], ack 1297624595, win 1408, options [nop,nop,TS val 932159200 ecr 541496943], length 0
16:04:14.871751 IP 192.168.122.239.8080 > 192.168.122.1.41209: Flags [P.], seq 1877257020:1877259324, ack 1297624595, win 1408, options [nop,nop,TS val 932159200 ecr 541496943], length 2304
16:04:14.871777 IP 192.168.122.239.8080 > 192.168.122.1.41209: Flags [.], seq 1877259324:1877260772, ack 1297624595, win 1408, options [nop,nop,TS val 932159200 ecr 541496943], length 1448
16:04:14.871779 IP 192.168.122.239.8080 > 192.168.122.1.41209: Flags [.], seq 1877260772:1877263668, ack 1297624595, win 1408, options [nop,nop,TS val 932159200 ecr 541496943], length 2896
16:04:14.871803 IP 192.168.122.1.41209 > 192.168.122.239.8080: Flags [.], seq 1297624595:1297626043, ack 1877257020, win 1279, options [nop,nop,TS val 541496955 ecr 932159200], length 1448
16:04:14.871806 IP 192.168.122.1.41209 > 192.168.122.239.8080: Flags [.], seq 1297626043:1297628939, ack 1877257020, win 1279, options [nop,nop,TS val 541496955 ecr 932159200], length 2896
16:04:14.871813 IP 192.168.122.239.8080 > 192.168.122.1.41209: Flags [.], seq 1877263668:1877265116, ack 1297624595, win 1408, options [nop,nop,TS val 932159200 ecr 541496943], length 1448
16:04:14.871821 IP 192.168.122.1.41209 > 192.168.122.239.8080: Flags [.], ack 1877263668, win 1260, options [nop,nop,TS val 541496955 ecr 932159200], length 0
16:04:14.871823 IP 192.168.122.239.8080 > 192.168.122.1.41209: Flags [.], seq 1877265116:1877268012, ack 1297624595, win 1452, options [nop,nop,TS val 932159200 ecr 541496943], length 2896
16:04:14.871887 IP 192.168.122.1.41209 > 192.168.122.239.8080: Flags [.], ack 1877268012, win 1296, options [nop,nop,TS val 541496955 ecr 932159200], length 0
16:04:14.921816 IP 192.168.122.239.8080 > 192.168.122.1.41209: Flags [.], seq 1877268012:1877269460, ack 1297626043, win 1452, options [nop,nop,TS val 932159212 ecr 541496955], length 1448
16:04:14.921839 IP 192.168.122.239.8080 > 192.168.122.1.41209: Flags [P.], seq 1877269460:1877270052, ack 1297628939, win 1448, options [nop,nop,TS val 932159212 ecr 541496955], length 592
16:04:14.921854 IP 192.168.122.239.8080 > 192.168.122.1.41209: Flags [.], seq 1877270052:1877271500, ack 1297628939, win 1448, options [nop,nop,TS val 932159212 ecr 541496955], length 1448
16:04:14.921857 IP 192.168.122.239.8080 > 192.168.122.1.41209: Flags [.], seq 1877271500:1877272948, ack 1297628939, win 1452, options [nop,nop,TS val 932159212 ecr 541496955], length 1448
16:04:14.921884 IP 192.168.122.1.41209 > 192.168.122.239.8080: Flags [.], seq 1297628939:1297630387, ack 1877269460, win 1287, options [nop,nop,TS val 541496968 ecr 932159212], length 1448
16:04:14.921893 IP 192.168.122.1.41209 > 192.168.122.239.8080: Flags [.], seq 1297630387:1297633283, ack 1877270052, win 1283, options [nop,nop,TS val 541496968 ecr 932159212], length 2896
16:04:14.960010 IP 192.168.122.1.41209 > 192.168.122.239.8080: Flags [.], ack 1877272948, win 1261, options [nop,nop,TS val 541496978 ecr 932159212], length 0
16:04:14.971909 IP 192.168.122.239.8080 > 192.168.122.1.41209: Flags [.], seq 1877272948:1877274396, ack 1297630387, win 1452, options [nop,nop,TS val 932159225 ecr 541496968], length 1448
16:04:14.971913 IP 192.168.122.239.8080 > 192.168.122.1.41209: Flags [P.], seq 1877274396:1877274939, ack 1297633283, win 1446, options [nop,nop,TS val 932159225 ecr 541496968], length 543
16:04:14.971914 IP 192.168.122.239.8080 > 192.168.122.1.41209: Flags [.], seq 1877274939:1877276387, ack 1297633283, win 1446, options [nop,nop,TS val 932159225 ecr 541496968], length 1448
16:04:14.971944 IP 192.168.122.239.8080 > 192.168.122.1.41209: Flags [.], seq 1877276387:1877277835, ack 1297633283, win 1452, options [nop,nop,TS val 932159225 ecr 541496968], length 1448
16:04:14.972003 IP 192.168.122.1.41209 > 192.168.122.239.8080: Flags [.], seq 1297633283:1297634731, ack 1877274396, win 1251, options [nop,nop,TS val 541496981 ecr 932159225], length 1448
16:04:14.972019 IP 192.168.122.1.41209 > 192.168.122.239.8080: Flags [.], seq 1297634731:1297637627, ack 1877274939, win 1247, options [nop,nop,TS val 541496981 ecr 932159225], length 2896
16:04:14.972054 IP 192.168.122.1.41209 > 192.168.122.239.8080: Flags [.], ack 1877277835, win 1251, options [nop,nop,TS val 541496981 ecr 932159225], length 0
16:04:15.022029 IP 192.168.122.239.8080 > 192.168.122.1.41209: Flags [P.], seq 1877277835:1877278197, ack 1297637627, win 1448, options [nop,nop,TS val 932159237 ecr 541496981], length 362
16:04:15.022043 IP 192.168.122.239.8080 > 192.168.122.1.41209: Flags [.], seq 1877278197:1877279645, ack 1297637627, win 1448, options [nop,nop,TS val 932159237 ecr 541496981], length 1448
16:04:15.022044 IP 192.168.122.239.8080 > 192.168.122.1.41209: Flags [.], seq 1877279645:1877281093, ack 1297637627, win 1448, options [nop,nop,TS val 932159237 ecr 541496981], length 1448
16:04:15.022062 IP 192.168.122.239.8080 > 192.168.122.1.41209: Flags [.], seq 1877281093:1877282541, ack 1297637627, win 1452, options [nop,nop,TS val 932159237 ecr 541496981], length 1448
16:04:15.022109 IP 192.168.122.1.41209 > 192.168.122.239.8080: Flags [.], seq 1297637627:1297640523, ack 1877278197, win 1304, options [nop,nop,TS val 541496993 ecr 932159237], length 2896
16:04:15.022134 IP 192.168.122.1.41209 > 192.168.122.239.8080: Flags [.], seq 1297640523:1297641971, ack 1877278197, win 1304, options [nop,nop,TS val 541496993 ecr 932159237], length 1448
16:04:15.060011 IP 192.168.122.1.41209 > 192.168.122.239.8080: Flags [.], ack 1877282541, win 1277, options [nop,nop,TS val 541497003 ecr 932159237], length 0
16:04:15.072185 IP 192.168.122.239.8080 > 192.168.122.1.41209: Flags [P.], seq 1877282541:1877283084, ack 1297640523, win 1448, options [nop,nop,TS val 932159250 ecr 541496993], length 543
16:04:15.072192 IP 192.168.122.239.8080 > 192.168.122.1.41209: Flags [.], seq 1877283084:1877284532, ack 1297640523, win 1448, options [nop,nop,TS val 932159250 ecr 541496993], length 1448
16:04:15.072193 IP 192.168.122.239.8080 > 192.168.122.1.41209: Flags [.], seq 1877284532:1877285980, ack 1297640523, win 1452, options [nop,nop,TS val 932159250 ecr 541496993], length 1448
16:04:15.072223 IP 192.168.122.239.8080 > 192.168.122.1.41209: Flags [.], seq 1877285980:1877287428, ack 1297641971, win 1452, options [nop,nop,TS val 932159250 ecr 541496993], length 1448
16:04:15.072290 IP 192.168.122.1.41209 > 192.168.122.239.8080: Flags [.], seq 1297641971:1297643419, ack 1877283084, win 1273, options [nop,nop,TS val 541497006 ecr 932159250], length 1448
16:04:15.072304 IP 192.168.122.1.41209 > 192.168.122.239.8080: Flags [.], seq 1297643419:1297646315, ack 1877283084, win 1273, options [nop,nop,TS val 541497006 ecr 932159250], length 2896
16:04:15.072305 IP 192.168.122.1.41209 > 192.168.122.239.8080: Flags [.], ack 1877285980, win 1280, options [nop,nop,TS val 541497006 ecr 932159250], length 0
16:04:15.112044 IP 192.168.122.1.41209 > 192.168.122.239.8080: Flags [.], ack 1877287428, win 1297, options [nop,nop,TS val 541497016 ecr 932159250], length 0
16:04:15.122327 IP 192.168.122.239.8080 > 192.168.122.1.41209: Flags [P.], seq 1877287428:1877287971, ack 1297643419, win 1452, options [nop,nop,TS val 932159262 ecr 541497006], length 543
16:04:15.122334 IP 192.168.122.239.8080 > 192.168.122.1.41209: Flags [.], seq 1877287971:1877289419, ack 1297646315, win 1448, options [nop,nop,TS val 932159262 ecr 541497006], length 1448
16:04:15.122335 IP 192.168.122.239.8080 > 192.168.122.1.41209: Flags [.], seq 1877289419:1877290867, ack 1297646315, win 1448, options [nop,nop,TS val 932159262 ecr 541497006], length 1448
16:04:15.122366 IP 192.168.122.239.8080 > 192.168.122.1.41209: Flags [.], seq 1877290867:1877292315, ack 1297646315, win 1452, options [nop,nop,TS val 932159262 ecr 541497006], length 1448
16:04:15.122435 IP 192.168.122.1.41209 > 192.168.122.239.8080: Flags [P.], seq 1297646315:1297649211, ack 1877287971, win 1293, options [nop,nop,TS val 541497018 ecr 932159262], length 2896
16:04:15.122444 IP 192.168.122.1.41209 > 192.168.122.239.8080: Flags [.], seq 1297649211:1297652107, ack 1877289419, win 1283, options [nop,nop,TS val 541497018 ecr 932159262], length 2896
16:04:15.122447 IP 192.168.122.1.41209 > 192.168.122.239.8080: Flags [.], ack 1877292315, win 1291, options [nop,nop,TS val 541497018 ecr 932159262], length 0
16:04:15.172469 IP 192.168.122.239.8080 > 192.168.122.1.41209: Flags [P.], seq 1877292315:1877292858, ack 1297649211, win 1448, options [nop,nop,TS val 932159275 ecr 541497018], length 543
16:04:15.172476 IP 192.168.122.239.8080 > 192.168.122.1.41209: Flags [.], seq 1877292858:1877294306, ack 1297652107, win 1434, options [nop,nop,TS val 932159275 ecr 541497018], length 1448
16:04:15.172478 IP 192.168.122.239.8080 > 192.168.122.1.41209: Flags [.], seq 1877294306:1877297202, ack 1297652107, win 1434, options [nop,nop,TS val 932159275 ecr 541497018], length 2896
16:04:15.172513 IP 192.168.122.239.8080 > 192.168.122.1.41209: Flags [.], seq 1877297202:1877298650, ack 1297652107, win 1452, options [nop,nop,TS val 932159275 ecr 541497018], length 1448
16:04:15.172519 IP 192.168.122.1.41209 > 192.168.122.239.8080: Flags [.], seq 1297652107:1297655003, ack 1877292858, win 1287, options [nop,nop,TS val 541497031 ecr 932159275], length 2896
16:04:15.172531 IP 192.168.122.1.41209 > 192.168.122.239.8080: Flags [P.], seq 1297655003:1297657899, ack 1877294306, win 1304, options [nop,nop,TS val 541497031 ecr 932159275], length 2896
16:04:15.172545 IP 192.168.122.1.41209 > 192.168.122.239.8080: Flags [.], ack 1877298650, win 1310, options [nop,nop,TS val 541497031 ecr 932159275], length 0
16:04:15.222566 IP 192.168.122.239.8080 > 192.168.122.1.41209: Flags [P.], seq 1877298650:1877299374, ack 1297655003, win 1448, options [nop,nop,TS val 932159287 ecr 541497031], length 724
16:04:15.222572 IP 192.168.122.239.8080 > 192.168.122.1.41209: Flags [.], seq 1877299374:1877300822, ack 1297657899, win 1434, options [nop,nop,TS val 932159287 ecr 541497031], length 1448
16:04:15.222574 IP 192.168.122.239.8080 > 192.168.122.1.41209: Flags [.], seq 1877300822:1877303718, ack 1297657899, win 1434, options [nop,nop,TS val 932159287 ecr 541497031], length 2896
16:04:15.222634 IP 192.168.122.239.8080 > 192.168.122.1.41209: Flags [.], seq 1877303718:1877305166, ack 1297657899, win 1452, options [nop,nop,TS val 932159287 ecr 541497031], length 1448
16:04:15.222638 IP 192.168.122.1.41209 > 192.168.122.239.8080: Flags [.], seq 1297657899:1297660795, ack 1877299374, win 1305, options [nop,nop,TS val 541497043 ecr 932159287], length 2896
16:04:15.222649 IP 192.168.122.1.41209 > 192.168.122.239.8080: Flags [.], seq 1297660795:1297663691, ack 1877300822, win 1294, options [nop,nop,TS val 541497043 ecr 932159287], length 2896
16:04:15.222652 IP 192.168.122.1.41209 > 192.168.122.239.8080: Flags [.], ack 1877303718, win 1298, options [nop,nop,TS val 541497043 ecr 932159287], length 0
16:04:15.260010 IP 192.168.122.1.41209 > 192.168.122.239.8080: Flags [.], ack 1877305166, win 1289, options [nop,nop,TS val 541497053 ecr 932159287], length 0
