14:25:14.240130 IP 192.168.122.239.35366 > 172.27.17.201.8080: Flags [S], seq 152641444, win 29200, options [mss 1460,sackOK,TS val 2162694897 ecr 0,nop,wscale 7], length 0
14:25:14.240228 IP 172.27.17.201.8080 > 192.168.122.239.35366: Flags [S.], seq 2519308851, ack 152641445, win 28960, options [mss 1460,sackOK,TS val 540011798 ecr 2162694897,nop,wscale 7], length 0
14:25:14.240246 IP 192.168.122.239.35366 > 172.27.17.201.8080: Flags [.], ack 2519308852, win 229, options [nop,nop,TS val 2162694897 ecr 540011798], length 0
14:25:14.240276 IP 192.168.122.239.35366 > 172.27.17.201.8080: Flags [P.], seq 152641445:152645541, ack 2519308852, win 229, options [nop,nop,TS val 2162694897 ecr 540011798], length 4096
14:25:14.240282 IP 192.168.122.239.35366 > 172.27.17.201.8080: Flags [.], seq 152645541:152648437, ack 2519308852, win 229, options [nop,nop,TS val 2162694897 ecr 540011798], length 2896
14:25:14.240285 IP 192.168.122.239.35366 > 172.27.17.201.8080: Flags [.], seq 152648437:152652781, ack 2519308852, win 229, options [nop,nop,TS val 2162694897 ecr 540011798], length 4344
14:25:14.240288 IP 192.168.122.239.35366 > 172.27.17.201.8080: Flags [.], seq 152652781:152655677, ack 2519308852, win 229, options [nop,nop,TS val 2162694897 ecr 540011798], length 2896
14:25:14.240310 IP 172.27.17.201.8080 > 192.168.122.239.35366: Flags [.], ack 152645541, win 291, options [nop,nop,TS val 540011798 ecr 2162694897], length 0
14:25:14.240314 IP 192.168.122.239.35366 > 172.27.17.201.8080: Flags [.], seq 152655677:152664365, ack 2519308852, win 229, options [nop,nop,TS val 2162694897 ecr 540011798], length 8688
14:25:14.240318 IP 172.27.17.201.8080 > 192.168.122.239.35366: Flags [.], ack 152648437, win 336, options [nop,nop,TS val 540011798 ecr 2162694897], length 0
14:25:14.240320 IP 192.168.122.239.35366 > 172.27.17.201.8080: Flags [.], seq 152664365:152670157, ack 2519308852, win 229, options [nop,nop,TS val 2162694897 ecr 540011798], length 5792
14:25:14.240322 IP 172.27.17.201.8080 > 192.168.122.239.35366: Flags [.], ack 152652781, win 404, options [nop,nop,TS val 540011798 ecr 2162694897], length 0
14:25:14.240323 IP 192.168.122.239.35366 > 172.27.17.201.8080: Flags [.], seq 152670157:152678845, ack 2519308852, win 229, options [nop,nop,TS val 2162694897 ecr 540011798], length 8688
14:25:14.240325 IP 172.27.17.201.8080 > 192.168.122.239.35366: Flags [.], ack 152655677, win 449, options [nop,nop,TS val 540011798 ecr 2162694897], length 0
14:25:14.240327 IP 192.168.122.239.35366 > 172.27.17.201.8080: Flags [.], seq 152678845:152684637, ack 2519308852, win 229, options [nop,nop,TS val 2162694897 ecr 540011798], length 5792
14:25:14.240341 IP 172.27.17.201.8080 > 192.168.122.239.35366: Flags [P.], seq 2519308852:2519311156, ack 152655677, win 449, options [nop,nop,TS val 540011798 ecr 2162694897], length 2304
14:25:14.240344 IP 192.168.122.239.35366 > 172.27.17.201.8080: Flags [.], ack 2519311156, win 265, options [nop,nop,TS val 2162694897 ecr 540011798], length 0
14:25:14.240348 IP 172.27.17.201.8080 > 192.168.122.239.35366: Flags [.], ack 152664365, win 585, options [nop,nop,TS val 540011798 ecr 2162694897], length 0
14:25:14.240349 IP 192.168.122.239.35366 > 172.27.17.201.8080: Flags [.], seq 152684637:152699117, ack 2519311156, win 265, options [nop,nop,TS val 2162694897 ecr 540011798], length 14480
14:25:14.240351 IP 192.168.122.239.35366 > 172.27.17.201.8080: Flags [.], seq 152699117:152702013, ack 2519311156, win 265, options [nop,nop,TS val 2162694897 ecr 540011798], length 2896
14:25:14.240353 IP 172.27.17.201.8080 > 192.168.122.239.35366: Flags [.], ack 152670157, win 675, options [nop,nop,TS val 540011798 ecr 2162694897], length 0
14:25:14.240355 IP 192.168.122.239.35366 > 172.27.17.201.8080: Flags [.], seq 152702013:152713597, ack 2519311156, win 265, options [nop,nop,TS val 2162694897 ecr 540011798], length 11584
14:25:14.240357 IP 172.27.17.201.8080 > 192.168.122.239.35366: Flags [.], ack 152678845, win 811, options [nop,nop,TS val 540011798 ecr 2162694897], length 0
14:25:14.240359 IP 192.168.122.239.35366 > 172.27.17.201.8080: Flags [.], seq 152713597:152726629, ack 2519311156, win 265, options [nop,nop,TS val 2162694897 ecr 540011798], length 13032
14:25:14.240361 IP 192.168.122.239.35366 > 172.27.17.201.8080: Flags [P.], seq 152726629:152727461, ack 2519311156, win 265, options [nop,nop,TS val 2162694897 ecr 540011798], length 832
14:25:14.240363 IP 172.27.17.201.8080 > 192.168.122.239.35366: Flags [.], seq 2519311156:2519312604, ack 152678845, win 811, options [nop,nop,TS val 540011798 ecr 2162694897], length 1448
14:25:14.240364 IP 172.27.17.201.8080 > 192.168.122.239.35366: Flags [.], ack 152684637, win 902, options [nop,nop,TS val 540011798 ecr 2162694897], length 0
14:25:14.240366 IP 172.27.17.201.8080 > 192.168.122.239.35366: Flags [.], seq 2519312604:2519315500, ack 152684637, win 902, options [nop,nop,TS val 540011798 ecr 2162694897], length 2896
14:25:14.240368 IP 192.168.122.239.35366 > 172.27.17.201.8080: Flags [.], ack 2519315500, win 332, options [nop,nop,TS val 2162694897 ecr 540011798], length 0
14:25:14.240381 IP 172.27.17.201.8080 > 192.168.122.239.35366: Flags [P.], seq 2519315500:2519318068, ack 152684637, win 902, options [nop,nop,TS val 540011798 ecr 2162694897], length 2568
14:25:14.240382 IP 192.168.122.239.35366 > 172.27.17.201.8080: Flags [.], ack 2519318068, win 373, options [nop,nop,TS val 2162694897 ecr 540011798], length 0
14:25:14.240387 IP 172.27.17.201.8080 > 192.168.122.239.35366: Flags [.], seq 2519318068:2519319516, ack 152684637, win 902, options [nop,nop,TS val 540011798 ecr 2162694897], length 1448
14:25:14.240388 IP 172.27.17.201.8080 > 192.168.122.239.35366: Flags [.], ack 152699117, win 1106, options [nop,nop,TS val 540011798 ecr 2162694897], length 0
14:25:14.240390 IP 172.27.17.201.8080 > 192.168.122.239.35366: Flags [.], seq 2519319516:2519322412, ack 152699117, win 1106, options [nop,nop,TS val 540011798 ecr 2162694897], length 2896
14:25:14.240391 IP 192.168.122.239.35366 > 172.27.17.201.8080: Flags [.], ack 2519322412, win 440, options [nop,nop,TS val 2162694897 ecr 540011798], length 0
14:25:14.240392 IP 172.27.17.201.8080 > 192.168.122.239.35366: Flags [.], ack 152702013, win 1089, options [nop,nop,TS val 540011798 ecr 2162694897], length 0
14:25:14.240393 IP 172.27.17.201.8080 > 192.168.122.239.35366: Flags [.], ack 152713597, win 1044, options [nop,nop,TS val 540011798 ecr 2162694897], length 0
14:25:14.240395 IP 172.27.17.201.8080 > 192.168.122.239.35366: Flags [.], ack 152727461, win 984, options [nop,nop,TS val 540011798 ecr 2162694897], length 0
14:25:14.240396 IP 172.27.17.201.8080 > 192.168.122.239.35366: Flags [.], seq 2519322412:2519326756, ack 152727461, win 984, options [nop,nop,TS val 540011798 ecr 2162694897], length 4344
14:25:14.240398 IP 192.168.122.239.35366 > 172.27.17.201.8080: Flags [.], ack 2519326756, win 508, options [nop,nop,TS val 2162694897 ecr 540011798], length 0
14:25:14.240402 IP 192.168.122.239.35366 > 172.27.17.201.8080: Flags [P.], seq 152727461:152731557, ack 2519326756, win 508, options [nop,nop,TS val 2162694897 ecr 540011798], length 4096
14:25:14.240406 IP 172.27.17.201.8080 > 192.168.122.239.35366: Flags [.], seq 2519326756:2519329652, ack 152727461, win 984, options [nop,nop,TS val 540011798 ecr 2162694897], length 2896
14:25:14.240408 IP 172.27.17.201.8080 > 192.168.122.239.35366: Flags [.], seq 2519329652:2519336892, ack 152727461, win 984, options [nop,nop,TS val 540011798 ecr 2162694897], length 7240
14:25:14.240410 IP 192.168.122.239.35366 > 172.27.17.201.8080: Flags [.], ack 2519329652, win 554, options [nop,nop,TS val 2162694897 ecr 540011798], length 0
14:25:14.240411 IP 192.168.122.239.35366 > 172.27.17.201.8080: Flags [.], ack 2519336892, win 667, options [nop,nop,TS val 2162694897 ecr 540011798], length 0
14:25:14.240416 IP 192.168.122.239.35366 > 172.27.17.201.8080: Flags [.], seq 152731557:152734453, ack 2519336892, win 667, options [nop,nop,TS val 2162694897 ecr 540011798], length 2896
14:25:14.240420 IP 192.168.122.239.35366 > 172.27.17.201.8080: Flags [.], seq 152734453:152738797, ack 2519336892, win 667, options [nop,nop,TS val 2162694897 ecr 540011798], length 4344
14:25:14.240440 IP 172.27.17.201.8080 > 192.168.122.239.35366: Flags [.], ack 152731557, win 1192, options [nop,nop,TS val 540011798 ecr 2162694897], length 0
14:25:14.240441 IP 172.27.17.201.8080 > 192.168.122.239.35366: Flags [.], seq 2519336892:2519344132, ack 152731557, win 1192, options [nop,nop,TS val 540011798 ecr 2162694897], length 7240
14:25:14.240443 IP 172.27.17.201.8080 > 192.168.122.239.35366: Flags [.], seq 2519344132:2519351372, ack 152731557, win 1192, options [nop,nop,TS val 540011798 ecr 2162694897], length 7240
14:25:14.240445 IP 172.27.17.201.8080 > 192.168.122.239.35366: Flags [.], ack 152734453, win 1197, options [nop,nop,TS val 540011798 ecr 2162694897], length 0
14:25:14.240447 IP 192.168.122.239.35366 > 172.27.17.201.8080: Flags [P.], seq 152738797:152739749, ack 2519336892, win 667, options [nop,nop,TS val 2162694897 ecr 540011798], length 952
14:25:14.240449 IP 192.168.122.239.35366 > 172.27.17.201.8080: Flags [.], ack 2519344132, win 780, options [nop,nop,TS val 2162694897 ecr 540011798], length 0
14:25:14.240451 IP 192.168.122.239.35366 > 172.27.17.201.8080: Flags [.], ack 2519351372, win 893, options [nop,nop,TS val 2162694897 ecr 540011798], length 0
14:25:14.240455 IP 192.168.122.239.35366 > 172.27.17.201.8080: Flags [.], seq 152739749:152742645, ack 2519351372, win 893, options [nop,nop,TS val 2162694897 ecr 540011798], length 2896
14:25:14.240459 IP 192.168.122.239.35366 > 172.27.17.201.8080: Flags [.], seq 152742645:152746989, ack 2519351372, win 893, options [nop,nop,TS val 2162694897 ecr 540011798], length 4344
14:25:14.240463 IP 192.168.122.239.35366 > 172.27.17.201.8080: Flags [.], seq 152746989:152751333, ack 2519351372, win 893, options [nop,nop,TS val 2162694897 ecr 540011798], length 4344
14:25:14.240467 IP 192.168.122.239.35366 > 172.27.17.201.8080: Flags [.], seq 152751333:152755677, ack 2519351372, win 893, options [nop,nop,TS val 2162694897 ecr 540011798], length 4344
14:25:14.240470 IP 192.168.122.239.35366 > 172.27.17.201.8080: Flags [.], seq 152755677:152760021, ack 2519351372, win 893, options [nop,nop,TS val 2162694897 ecr 540011798], length 4344
14:25:14.240474 IP 192.168.122.239.35366 > 172.27.17.201.8080: Flags [.], seq 152760021:152762917, ack 2519351372, win 893, options [nop,nop,TS val 2162694897 ecr 540011798], length 2896
14:25:14.240478 IP 192.168.122.239.35366 > 172.27.17.201.8080: Flags [.], seq 152762917:152767261, ack 2519351372, win 893, options [nop,nop,TS val 2162694897 ecr 540011798], length 4344
14:25:14.240481 IP 192.168.122.239.35366 > 172.27.17.201.8080: Flags [.], seq 152767261:152771605, ack 2519351372, win 893, options [nop,nop,TS val 2162694897 ecr 540011798], length 4344
14:25:14.240485 IP 192.168.122.239.35366 > 172.27.17.201.8080: Flags [.], seq 152771605:152775949, ack 2519351372, win 893, options [nop,nop,TS val 2162694897 ecr 540011798], length 4344
14:25:14.240505 IP 172.27.17.201.8080 > 192.168.122.239.35366: Flags [.], ack 152738797, win 1287, options [nop,nop,TS val 540011798 ecr 2162694897], length 0
14:25:14.240507 IP 192.168.122.239.35366 > 172.27.17.201.8080: Flags [.], seq 152775949:152799117, ack 2519351372, win 893, options [nop,nop,TS val 2162694897 ecr 540011798], length 23168
14:25:14.240515 IP 172.27.17.201.8080 > 192.168.122.239.35366: Flags [.], seq 2519351372:2519358612, ack 152739749, win 1328, options [nop,nop,TS val 540011798 ecr 2162694897], length 7240
14:25:14.240518 IP 192.168.122.239.35366 > 172.27.17.201.8080: Flags [.], ack 2519358612, win 1006, options [nop,nop,TS val 2162694897 ecr 540011798], length 0
14:25:14.240519 IP 172.27.17.201.8080 > 192.168.122.239.35366: Flags [.], seq 2519358612:2519365852, ack 152739749, win 1328, options [nop,nop,TS val 540011798 ecr 2162694897], length 7240
14:25:14.240522 IP 192.168.122.239.35366 > 172.27.17.201.8080: Flags [.], ack 2519365852, win 1119, options [nop,nop,TS val 2162694897 ecr 540011798], length 0
14:25:14.240522 IP 172.27.17.201.8080 > 192.168.122.239.35366: Flags [.], ack 152742645, win 1373, options [nop,nop,TS val 540011798 ecr 2162694897], length 0
14:25:14.240524 IP 172.27.17.201.8080 > 192.168.122.239.35366: Flags [.], ack 152751333, win 1350, options [nop,nop,TS val 540011798 ecr 2162694897], length 0
14:25:14.240525 IP 172.27.17.201.8080 > 192.168.122.239.35366: Flags [.], ack 152755677, win 1352, options [nop,nop,TS val 540011798 ecr 2162694897], length 0
14:25:14.240526 IP 172.27.17.201.8080 > 192.168.122.239.35366: Flags [.], ack 152762917, win 1318, options [nop,nop,TS val 540011798 ecr 2162694897], length 0
14:25:14.240527 IP 192.168.122.239.35366 > 172.27.17.201.8080: Flags [P.], seq 152799117:152821669, ack 2519365852, win 1119, options [nop,nop,TS val 2162694897 ecr 540011798], length 22552
14:25:14.240534 IP 172.27.17.201.8080 > 192.168.122.239.35366: Flags [.], ack 152771605, win 1284, options [nop,nop,TS val 540011798 ecr 2162694897], length 0
14:25:14.240535 IP 172.27.17.201.8080 > 192.168.122.239.35366: Flags [.], ack 152775949, win 1267, options [nop,nop,TS val 540011798 ecr 2162694897], length 0
14:25:14.240536 IP 172.27.17.201.8080 > 192.168.122.239.35366: Flags [.], ack 152799117, win 1220, options [nop,nop,TS val 540011798 ecr 2162694897], length 0
14:25:14.240538 IP 172.27.17.201.8080 > 192.168.122.239.35366: Flags [.], seq 2519365852:2519373092, ack 152799117, win 1220, options [nop,nop,TS val 540011798 ecr 2162694897], length 7240
14:25:14.240540 IP 192.168.122.239.35366 > 172.27.17.201.8080: Flags [.], ack 2519373092, win 1232, options [nop,nop,TS val 2162694897 ecr 540011798], length 0
14:25:14.240542 IP 172.27.17.201.8080 > 192.168.122.239.35366: Flags [.], seq 2519373092:2519380332, ack 152799117, win 1220, options [nop,nop,TS val 540011798 ecr 2162694897], length 7240
14:25:14.240545 IP 192.168.122.239.35366 > 172.27.17.201.8080: Flags [.], ack 2519380332, win 1326, options [nop,nop,TS val 2162694897 ecr 540011798], length 0
14:25:14.240546 IP 172.27.17.201.8080 > 192.168.122.239.35366: Flags [.], ack 152821669, win 1213, options [nop,nop,TS val 540011798 ecr 2162694897], length 0
14:25:14.240549 IP 192.168.122.239.35366 > 172.27.17.201.8080: Flags [P.], seq 152821669:152825765, ack 2519380332, win 1326, options [nop,nop,TS val 2162694897 ecr 540011798], length 4096
14:25:14.240553 IP 192.168.122.239.35366 > 172.27.17.201.8080: Flags [.], seq 152825765:152828661, ack 2519380332, win 1326, options [nop,nop,TS val 2162694897 ecr 540011798], length 2896
14:25:14.240557 IP 192.168.122.239.35366 > 172.27.17.201.8080: Flags [.], seq 152828661:152833005, ack 2519380332, win 1326, options [nop,nop,TS val 2162694897 ecr 540011798], length 4344
14:25:14.240562 IP 192.168.122.239.35366 > 172.27.17.201.8080: Flags [.], seq 152833005:152837349, ack 2519380332, win 1326, options [nop,nop,TS val 2162694897 ecr 540011798], length 4344
14:25:14.240566 IP 172.27.17.201.8080 > 192.168.122.239.35366: Flags [.], seq 2519380332:2519389020, ack 152821669, win 1213, options [nop,nop,TS val 540011798 ecr 2162694897], length 8688
14:25:14.240569 IP 172.27.17.201.8080 > 192.168.122.239.35366: Flags [.], ack 152825765, win 1194, options [nop,nop,TS val 540011798 ecr 2162694897], length 0
14:25:14.240570 IP 172.27.17.201.8080 > 192.168.122.239.35366: Flags [.], ack 152828661, win 1177, options [nop,nop,TS val 540011798 ecr 2162694897], length 0
14:25:14.240570 IP 172.27.17.201.8080 > 192.168.122.239.35366: Flags [.], ack 152833005, win 1160, options [nop,nop,TS val 540011798 ecr 2162694897], length 0
14:25:14.240573 IP 192.168.122.239.35366 > 172.27.17.201.8080: Flags [P.], seq 152837349:152838053, ack 2519389020, win 1288, options [nop,nop,TS val 2162694897 ecr 540011798], length 704
14:25:14.240577 IP 172.27.17.201.8080 > 192.168.122.239.35366: Flags [.], ack 152837349, win 1143, options [nop,nop,TS val 540011798 ecr 2162694897], length 0
14:25:14.240582 IP 192.168.122.239.35366 > 172.27.17.201.8080: Flags [.], seq 152838053:152840949, ack 2519389020, win 1288, options [nop,nop,TS val 2162694897 ecr 540011798], length 2896
14:25:14.240589 IP 172.27.17.201.8080 > 192.168.122.239.35366: Flags [.], seq 2519396260:2519404948, ack 152838053, win 1138, options [nop,nop,TS val 540011798 ecr 2162694897], length 8688
14:25:14.240592 IP 192.168.122.239.35366 > 172.27.17.201.8080: Flags [P.], seq 152840949:152842149, ack 2519389020, win 1288, options [nop,nop,TS val 2162694897 ecr 540011798,nop,nop,sack 1 {2519396260:2519404948}], length 1200
14:25:14.240599 IP 192.168.122.239.35366 > 172.27.17.201.8080: Flags [.], seq 152842149:152845021, ack 2519389020, win 1288, options [nop,nop,TS val 2162694897 ecr 540011798,nop,nop,sack 1 {2519396260:2519404948}], length 2872
14:25:14.240603 IP 192.168.122.239.35366 > 172.27.17.201.8080: Flags [.], seq 152845021:152849329, ack 2519389020, win 1288, options [nop,nop,TS val 2162694897 ecr 540011798,nop,nop,sack 1 {2519396260:2519404948}], length 4308
14:25:14.240606 IP 192.168.122.239.35366 > 172.27.17.201.8080: Flags [.], seq 152849329:152853637, ack 2519389020, win 1288, options [nop,nop,TS val 2162694897 ecr 540011798,nop,nop,sack 1 {2519396260:2519404948}], length 4308
14:25:14.240609 IP 192.168.122.239.35366 > 172.27.17.201.8080: Flags [.], seq 152853637:152857945, ack 2519389020, win 1288, options [nop,nop,TS val 2162694897 ecr 540011798,nop,nop,sack 1 {2519396260:2519404948}], length 4308
14:25:14.240613 IP 192.168.122.239.35366 > 172.27.17.201.8080: Flags [.], seq 152857945:152862253, ack 2519389020, win 1288, options [nop,nop,TS val 2162694897 ecr 540011798,nop,nop,sack 1 {2519396260:2519404948}], length 4308
14:25:14.240617 IP 192.168.122.239.35366 > 172.27.17.201.8080: Flags [.], seq 152862253:152866561, ack 2519389020, win 1345, options [nop,nop,TS val 2162694897 ecr 540011798,nop,nop,sack 1 {2519396260:2519404948}], length 4308
14:25:14.240620 IP 192.168.122.239.35366 > 172.27.17.201.8080: Flags [.], seq 152866561:152869433, ack 2519389020, win 1345, options [nop,nop,TS val 2162694897 ecr 540011798,nop,nop,sack 1 {2519396260:2519404948}], length 2872
14:25:14.240623 IP 192.168.122.239.35366 > 172.27.17.201.8080: Flags [.], seq 152869433:152873741, ack 2519389020, win 1345, options [nop,nop,TS val 2162694897 ecr 540011798,nop,nop,sack 1 {2519396260:2519404948}], length 4308
14:25:14.240626 IP 192.168.122.239.35366 > 172.27.17.201.8080: Flags [.], seq 152873741:152878049, ack 2519389020, win 1345, options [nop,nop,TS val 2162694897 ecr 540011798,nop,nop,sack 1 {2519396260:2519404948}], length 4308
14:25:14.240629 IP 192.168.122.239.35366 > 172.27.17.201.8080: Flags [.], seq 152878049:152882357, ack 2519389020, win 1345, options [nop,nop,TS val 2162694897 ecr 540011798,nop,nop,sack 1 {2519396260:2519404948}], length 4308
14:25:14.240651 IP 192.168.122.239.35366 > 172.27.17.201.8080: Flags [.], seq 152882357:152902461, ack 2519389020, win 1345, options [nop,nop,TS val 2162694897 ecr 540011798,nop,nop,sack 1 {2519396260:2519404948}], length 20104
14:25:14.240680 IP 172.27.17.201.8080 > 192.168.122.239.35366: Flags [.], seq 2519389020:2519396260, ack 152840949, win 1117, options [nop,nop,TS val 540011798 ecr 2162694897], length 7240
14:25:14.240687 IP 192.168.122.239.35366 > 172.27.17.201.8080: Flags [.], ack 2519404948, win 1376, options [nop,nop,TS val 2162694897 ecr 540011798], length 0
14:25:14.240691 IP 172.27.17.201.8080 > 192.168.122.239.35366: Flags [.], seq 2519404948:2519407844, ack 152842149, win 1108, options [nop,nop,TS val 540011798 ecr 2162694897], length 2896
14:25:14.240696 IP 192.168.122.239.35366 > 172.27.17.201.8080: Flags [.], seq 152902461:152906805, ack 2519407844, win 1362, options [nop,nop,TS val 2162694897 ecr 540011798], length 4344
14:25:14.240738 IP 172.27.17.201.8080 > 192.168.122.239.35366: Flags [.], seq 2519407844:2519409292, ack 152902461, win 846, options [nop,nop,TS val 540011798 ecr 2162694897], length 1448
14:25:14.240742 IP 192.168.122.239.35366 > 172.27.17.201.8080: Flags [.], seq 152906805:152940109, ack 2519409292, win 1444, options [nop,nop,TS val 2162694897 ecr 540011798], length 33304
14:25:14.240758 IP 192.168.122.239.35366 > 172.27.17.201.8080: Flags [.], seq 152940109:152970517, ack 2519409292, win 1444, options [nop,nop,TS val 2162694897 ecr 540011798], length 30408
14:25:14.240761 IP 172.27.17.201.8080 > 192.168.122.239.35366: Flags [.], seq 2519409292:2519415084, ack 152902461, win 846, options [nop,nop,TS val 540011798 ecr 2162694897], length 5792
14:25:14.240764 IP 172.27.17.201.8080 > 192.168.122.239.35366: Flags [.], seq 2519415084:2519419428, ack 152906805, win 829, options [nop,nop,TS val 540011798 ecr 2162694897], length 4344
14:25:14.240766 IP 192.168.122.239.35366 > 172.27.17.201.8080: Flags [.], seq 152970517:152971965, ack 2519419428, win 1400, options [nop,nop,TS val 2162694897 ecr 540011798], length 1448
14:25:14.240767 IP 192.168.122.239.35366 > 172.27.17.201.8080: Flags [.], seq 152971965:152974861, ack 2519419428, win 1400, options [nop,nop,TS val 2162694897 ecr 540011798], length 2896
14:25:14.240822 IP 172.27.17.201.8080 > 192.168.122.239.35366: Flags [.], ack 152940109, win 854, options [nop,nop,TS val 540011798 ecr 2162694897], length 0
14:25:14.240825 IP 192.168.122.239.35366 > 172.27.17.201.8080: Flags [.], seq 152974861:153009613, ack 2519419428, win 1444, options [nop,nop,TS val 2162694897 ecr 540011798], length 34752
14:25:14.240833 IP 172.27.17.201.8080 > 192.168.122.239.35366: Flags [.], seq 2519419428:2519431012, ack 152971965, win 726, options [nop,nop,TS val 540011798 ecr 2162694897], length 11584
14:25:14.240836 IP 192.168.122.239.35366 > 172.27.17.201.8080: Flags [.], seq 153009613:153037125, ack 2519431012, win 1404, options [nop,nop,TS val 2162694897 ecr 540011798], length 27512
14:25:14.240839 IP 172.27.17.201.8080 > 192.168.122.239.35366: Flags [.], ack 152974861, win 709, options [nop,nop,TS val 540011798 ecr 2162694897], length 0
14:25:14.240841 IP 192.168.122.239.35366 > 172.27.17.201.8080: Flags [.], seq 153037125:153047261, ack 2519431012, win 1404, options [nop,nop,TS val 2162694897 ecr 540011798], length 10136
14:25:14.240855 IP 172.27.17.201.8080 > 192.168.122.239.35366: Flags [.], ack 153009613, win 684, options [nop,nop,TS val 540011798 ecr 2162694897], length 0
14:25:14.240858 IP 192.168.122.239.35366 > 172.27.17.201.8080: Flags [.], seq 153047261:153083461, ack 2519431012, win 1444, options [nop,nop,TS val 2162694897 ecr 540011798], length 36200
14:25:14.240867 IP 172.27.17.201.8080 > 192.168.122.239.35366: Flags [.], ack 153047261, win 534, options [nop,nop,TS val 540011798 ecr 2162694897], length 0
14:25:14.240870 IP 192.168.122.239.35366 > 172.27.17.201.8080: Flags [.], seq 153083461:153102285, ack 2519431012, win 1444, options [nop,nop,TS val 2162694897 ecr 540011798], length 18824
14:25:14.240872 IP 192.168.122.239.35366 > 172.27.17.201.8080: Flags [.], seq 153102285:153115613, ack 2519431012, win 1444, options [nop,nop,TS val 2162694897 ecr 540011798], length 13328
14:25:14.280031 IP 172.27.17.201.8080 > 192.168.122.239.35366: Flags [.], ack 153115613, win 264, options [nop,nop,TS val 540011808 ecr 2162694897], length 0
14:25:14.280054 IP 192.168.122.239.35366 > 172.27.17.201.8080: Flags [.], seq 153115613:153132989, ack 2519431012, win 1444, options [nop,nop,TS val 2162694907 ecr 540011798], length 17376
14:25:14.280072 IP 192.168.122.239.35366 > 172.27.17.201.8080: Flags [.], seq 153132989:153149405, ack 2519431012, win 1444, options [nop,nop,TS val 2162694907 ecr 540011798], length 16416
14:25:14.280151 IP 172.27.17.201.8080 > 192.168.122.239.35366: Flags [.], seq 2519441148:2519444044, ack 153132989, win 196, options [nop,nop,TS val 540011808 ecr 2162694907], length 2896
14:25:14.280161 IP 192.168.122.239.35366 > 172.27.17.201.8080: Flags [.], seq 153149405:153158021, ack 2519431012, win 1444, options [nop,nop,TS val 2162694907 ecr 540011798,nop,nop,sack 1 {2519441148:2519444044}], length 8616
14:25:14.280241 IP 172.27.17.201.8080 > 192.168.122.239.35366: Flags [.], seq 2519431012:2519435356, ack 153149405, win 132, options [nop,nop,TS val 540011808 ecr 2162694907], length 4344
14:25:14.280256 IP 192.168.122.239.35366 > 172.27.17.201.8080: Flags [.], seq 153158021:153166301, ack 2519435356, win 1415, options [nop,nop,TS val 2162694907 ecr 540011808,nop,nop,sack 1 {2519441148:2519444044}], length 8280
14:25:14.280310 IP 172.27.17.201.8080 > 192.168.122.239.35366: Flags [.], seq 2519435356:2519439700, ack 153158021, win 98, options [nop,nop,TS val 540011808 ecr 2162694907], length 4344
14:25:14.280315 IP 192.168.122.239.35366 > 172.27.17.201.8080: Flags [.], seq 153166301:153167445, ack 2519439700, win 1415, options [nop,nop,TS val 2162694907 ecr 540011808,nop,nop,sack 1 {2519441148:2519444044}], length 1144
14:25:14.280321 IP 192.168.122.239.35366 > 172.27.17.201.8080: Flags [.], seq 153167445:153170317, ack 2519439700, win 1415, options [nop,nop,TS val 2162694907 ecr 540011808,nop,nop,sack 1 {2519441148:2519444044}], length 2872
14:25:14.280323 IP 172.27.17.201.8080 > 192.168.122.239.35366: Flags [.], seq 2519444044:2519445492, ack 153166301, win 63, options [nop,nop,TS val 540011808 ecr 2162694907], length 1448
14:25:14.280325 IP 192.168.122.239.35366 > 172.27.17.201.8080: Flags [.], seq 153170317:153173189, ack 2519439700, win 1415, options [nop,nop,TS val 2162694907 ecr 540011808,nop,nop,sack 1 {2519441148:2519445492}], length 2872
14:25:14.280351 IP 172.27.17.201.8080 > 192.168.122.239.35366: Flags [.], seq 2519445492:2519451284, ack 153167445, win 55, options [nop,nop,TS val 540011808 ecr 2162694907], length 5792
14:25:14.280354 IP 192.168.122.239.35366 > 172.27.17.201.8080: Flags [.], ack 2519439700, win 1415, options [nop,nop,TS val 2162694907 ecr 540011808,nop,nop,sack 1 {2519441148:2519451284}], length 0
14:25:14.280359 IP 172.27.17.201.8080 > 192.168.122.239.35366: Flags [.], seq 2519439700:2519441148, ack 153170317, win 37, options [nop,nop,TS val 540011808 ecr 2162694907], length 1448
14:25:14.280361 IP 192.168.122.239.35366 > 172.27.17.201.8080: Flags [.], seq 153173189:153175053, ack 2519451284, win 1398, options [nop,nop,TS val 2162694907 ecr 540011808], length 1864
14:25:14.280375 IP 172.27.17.201.8080 > 192.168.122.239.35366: Flags [.], seq 2519451284:2519452732, ack 153173189, win 20, options [nop,nop,TS val 540011808 ecr 2162694907], length 1448
14:25:14.280385 IP 172.27.17.201.8080 > 192.168.122.239.35366: Flags [.], seq 2519452732:2519458524, ack 153173189, win 20, options [nop,nop,TS val 540011808 ecr 2162694907], length 5792
14:25:14.280390 IP 192.168.122.239.35366 > 172.27.17.201.8080: Flags [.], ack 2519458524, win 1364, options [nop,nop,TS val 2162694907 ecr 540011808], length 0
14:25:14.280422 IP 172.27.17.201.8080 > 192.168.122.239.35366: Flags [.], ack 153175053, win 1373, options [nop,nop,TS val 540011808 ecr 2162694907], length 0
14:25:14.280425 IP 192.168.122.239.35366 > 172.27.17.201.8080: Flags [.], seq 153175053:153214149, ack 2519458524, win 1444, options [nop,nop,TS val 2162694907 ecr 540011808], length 39096
14:25:14.280434 IP 192.168.122.239.35366 > 172.27.17.201.8080: Flags [.], seq 153214149:153232605, ack 2519458524, win 1444, options [nop,nop,TS val 2162694907 ecr 540011808], length 18456
14:25:14.280439 IP 192.168.122.239.35366 > 172.27.17.201.8080: Flags [.], seq 153232605:153252877, ack 2519458524, win 1444, options [nop,nop,TS val 2162694907 ecr 540011808], length 20272
14:25:14.280454 IP 172.27.17.201.8080 > 192.168.122.239.35366: Flags [.], seq 2519458524:2519468660, ack 153175053, win 1373, options [nop,nop,TS val 540011808 ecr 2162694907], length 10136
14:25:14.280460 IP 192.168.122.239.35366 > 172.27.17.201.8080: Flags [.], ack 2519468660, win 1410, options [nop,nop,TS val 2162694907 ecr 540011808], length 0
14:25:14.280483 IP 172.27.17.201.8080 > 192.168.122.239.35366: Flags [.], ack 153214149, win 1984, options [nop,nop,TS val 540011808 ecr 2162694907], length 0
14:25:14.280486 IP 192.168.122.239.35366 > 172.27.17.201.8080: Flags [.], seq 153252877:153293421, ack 2519468660, win 1444, options [nop,nop,TS val 2162694907 ecr 540011808], length 40544
14:25:14.280497 IP 192.168.122.239.35366 > 172.27.17.201.8080: Flags [.], seq 153293421:153294869, ack 2519468660, win 1444, options [nop,nop,TS val 2162694907 ecr 540011808], length 1448
14:25:14.280499 IP 172.27.17.201.8080 > 192.168.122.239.35366: Flags [.], ack 153232605, win 2272, options [nop,nop,TS val 540011808 ecr 2162694907], length 0
14:25:14.280501 IP 192.168.122.239.35366 > 172.27.17.201.8080: Flags [.], seq 153294869:153297765, ack 2519468660, win 1444, options [nop,nop,TS val 2162694907 ecr 540011808], length 2896
14:25:14.280502 IP 192.168.122.239.35366 > 172.27.17.201.8080: Flags [.], seq 153297765:153313693, ack 2519468660, win 1444, options [nop,nop,TS val 2162694907 ecr 540011808], length 15928
14:25:14.280506 IP 172.27.17.201.8080 > 192.168.122.239.35366: Flags [.], ack 153252877, win 2589, options [nop,nop,TS val 540011808 ecr 2162694907], length 0
14:25:14.280508 IP 192.168.122.239.35366 > 172.27.17.201.8080: Flags [.], seq 153313693:153335413, ack 2519468660, win 1444, options [nop,nop,TS val 2162694907 ecr 540011808], length 21720
14:25:14.280513 IP 172.27.17.201.8080 > 192.168.122.239.35366: Flags [P.], seq 2519468660:2519473004, ack 153252877, win 2589, options [nop,nop,TS val 540011808 ecr 2162694907], length 4344
14:25:14.280520 IP 192.168.122.239.35366 > 172.27.17.201.8080: Flags [.], ack 2519473004, win 1434, options [nop,nop,TS val 2162694907 ecr 540011808], length 0
14:25:14.280531 IP 172.27.17.201.8080 > 192.168.122.239.35366: Flags [.], ack 153293421, win 3222, options [nop,nop,TS val 540011808 ecr 2162694907], length 0
14:25:14.280532 IP 172.27.17.201.8080 > 192.168.122.239.35366: Flags [.], ack 153297765, win 3290, options [nop,nop,TS val 540011808 ecr 2162694907], length 0
14:25:14.280532 IP 172.27.17.201.8080 > 192.168.122.239.35366: Flags [.], ack 153313693, win 3539, options [nop,nop,TS val 540011808 ecr 2162694907], length 0
14:25:14.280535 IP 192.168.122.239.35366 > 172.27.17.201.8080: Flags [.], seq 153335413:153362925, ack 2519473004, win 1444, options [nop,nop,TS val 2162694907 ecr 540011808], length 27512
14:25:14.280546 IP 172.27.17.201.8080 > 192.168.122.239.35366: Flags [.], ack 153335413, win 3878, options [nop,nop,TS val 540011808 ecr 2162694907], length 0
14:25:14.280547 IP 172.27.17.201.8080 > 192.168.122.239.35366: Flags [.], seq 2519478796:2519483140, ack 153335413, win 3878, options [nop,nop,TS val 540011808 ecr 2162694907], length 4344
14:25:14.280550 IP 192.168.122.239.35366 > 172.27.17.201.8080: Flags [.], seq 153362925:153378853, ack 2519473004, win 1444, options [nop,nop,TS val 2162694907 ecr 540011808], length 15928
14:25:14.280557 IP 192.168.122.239.35366 > 172.27.17.201.8080: Flags [.], seq 153378853:153383197, ack 2519473004, win 1444, options [nop,nop,TS val 2162694907 ecr 540011808], length 4344
14:25:14.280560 IP 192.168.122.239.35366 > 172.27.17.201.8080: Flags [.], seq 153383197:153399125, ack 2519473004, win 1444, options [nop,nop,TS val 2162694907 ecr 540011808], length 15928
14:25:14.280567 IP 192.168.122.239.35366 > 172.27.17.201.8080: Flags [.], seq 153399125:153422293, ack 2519473004, win 1444, options [nop,nop,TS val 2162694907 ecr 540011808], length 23168
14:25:14.280577 IP 172.27.17.201.8080 > 192.168.122.239.35366: Flags [.], ack 153362925, win 4308, options [nop,nop,TS val 540011808 ecr 2162694907], length 0
14:25:14.280578 IP 172.27.17.201.8080 > 192.168.122.239.35366: Flags [.], ack 153378853, win 4444, options [nop,nop,TS val 540011808 ecr 2162694907], length 0
14:25:14.280579 IP 172.27.17.201.8080 > 192.168.122.239.35366: Flags [.], ack 153383197, win 4427, options [nop,nop,TS val 540011808 ecr 2162694907], length 0
14:25:14.280582 IP 192.168.122.239.35366 > 172.27.17.201.8080: Flags [.], ack 2519473004, win 1444, options [nop,nop,TS val 2162694907 ecr 540011808,nop,nop,sack 1 {2519478796:2519483140}], length 0
14:25:14.280584 IP 192.168.122.239.35366 > 172.27.17.201.8080: Flags [.], seq 153422293:153428085, ack 2519473004, win 1444, options [nop,nop,TS val 2162694907 ecr 540011808,nop,nop,sack 1 {2519478796:2519483140}], length 5792
14:25:14.280587 IP 192.168.122.239.35366 > 172.27.17.201.8080: Flags [.], seq 153428085:153449625, ack 2519473004, win 1444, options [nop,nop,TS val 2162694907 ecr 540011808,nop,nop,sack 1 {2519478796:2519483140}], length 21540
14:25:14.280592 IP 192.168.122.239.35366 > 172.27.17.201.8080: Flags [.], seq 153449625:153466857, ack 2519473004, win 1444, options [nop,nop,TS val 2162694907 ecr 540011808,nop,nop,sack 1 {2519478796:2519483140}], length 17232
14:25:14.280597 IP 192.168.122.239.35366 > 172.27.17.201.8080: Flags [.], seq 153466857:153471165, ack 2519473004, win 1444, options [nop,nop,TS val 2162694907 ecr 540011808,nop,nop,sack 1 {2519478796:2519483140}], length 4308
14:25:14.280620 IP 172.27.17.201.8080 > 192.168.122.239.35366: Flags [.], seq 2519473004:2519478796, ack 153422293, win 4274, options [nop,nop,TS val 540011808 ecr 2162694907], length 5792
14:25:14.280625 IP 192.168.122.239.35366 > 172.27.17.201.8080: Flags [P.], seq 153471165:153493245, ack 2519483140, win 1402, options [nop,nop,TS val 2162694907 ecr 540011808], length 22080
14:25:14.280633 IP 192.168.122.239.35366 > 172.27.17.201.8080: Flags [.], seq 153493245:153510621, ack 2519483140, win 1402, options [nop,nop,TS val 2162694907 ecr 540011808], length 17376
14:25:14.280657 IP 172.27.17.201.8080 > 192.168.122.239.35366: Flags [.], seq 2519483140:2519488932, ack 153493245, win 3991, options [nop,nop,TS val 540011808 ecr 2162694907], length 5792
14:25:14.280662 IP 192.168.122.239.35366 > 172.27.17.201.8080: Flags [.], seq 153510621:153557865, ack 2519488932, win 1428, options [nop,nop,TS val 2162694907 ecr 540011808], length 47244
14:25:14.280672 IP 192.168.122.239.35366 > 172.27.17.201.8080: Flags [.], seq 153557865:153588273, ack 2519488932, win 1428, options [nop,nop,TS val 2162694907 ecr 540011808], length 30408
14:25:14.280678 IP 172.27.17.201.8080 > 192.168.122.239.35366: Flags [.], ack 153510621, win 3923, options [nop,nop,TS val 540011808 ecr 2162694907], length 0
14:25:14.280680 IP 192.168.122.239.35366 > 172.27.17.201.8080: Flags [.], seq 153588273:153605649, ack 2519488932, win 1428, options [nop,nop,TS val 2162694907 ecr 540011808], length 17376
14:25:14.280706 IP 172.27.17.201.8080 > 192.168.122.239.35366: Flags [P.], seq 2519488932:2519496172, ack 153557865, win 3736, options [nop,nop,TS val 540011808 ecr 2162694907], length 7240
14:25:14.280709 IP 192.168.122.239.35366 > 172.27.17.201.8080: Flags [.], seq 153605649:153623025, ack 2519496172, win 1422, options [nop,nop,TS val 2162694907 ecr 540011808], length 17376
14:25:14.280716 IP 192.168.122.239.35366 > 172.27.17.201.8080: Flags [.], seq 153623025:153656329, ack 2519496172, win 1422, options [nop,nop,TS val 2162694907 ecr 540011808], length 33304
14:25:14.280737 IP 172.27.17.201.8080 > 192.168.122.239.35366: Flags [.], seq 2519496172:2519503412, ack 153623025, win 3475, options [nop,nop,TS val 540011808 ecr 2162694907], length 7240
14:25:14.280741 IP 192.168.122.239.35366 > 172.27.17.201.8080: Flags [P.], seq 153656329:153688185, ack 2519503412, win 1422, options [nop,nop,TS val 2162694907 ecr 540011808], length 31856
14:25:14.280756 IP 192.168.122.239.35366 > 172.27.17.201.8080: Flags [.], seq 153688185:153724385, ack 2519503412, win 1422, options [nop,nop,TS val 2162694907 ecr 540011808], length 36200
14:25:14.280780 IP 172.27.17.201.8080 > 192.168.122.239.35366: Flags [.], seq 2519503412:2519512100, ack 153688185, win 3217, options [nop,nop,TS val 540011808 ecr 2162694907], length 8688
14:25:14.280784 IP 192.168.122.239.35366 > 172.27.17.201.8080: Flags [.], seq 153724385:153753345, ack 2519512100, win 1416, options [nop,nop,TS val 2162694907 ecr 540011808], length 28960
14:25:14.280791 IP 192.168.122.239.35366 > 172.27.17.201.8080: Flags [.], seq 153753345:153792441, ack 2519512100, win 1416, options [nop,nop,TS val 2162694907 ecr 540011808], length 39096
14:25:14.280796 IP 172.27.17.201.8080 > 192.168.122.239.35366: Flags [.], ack 153724385, win 3076, options [nop,nop,TS val 540011808 ecr 2162694907], length 0
14:25:14.280798 IP 192.168.122.239.35366 > 172.27.17.201.8080: Flags [.], seq 153792441:153818505, ack 2519512100, win 1416, options [nop,nop,TS val 2162694907 ecr 540011808], length 26064
14:25:14.280802 IP 192.168.122.239.35366 > 172.27.17.201.8080: Flags [.], seq 153818505:153831537, ack 2519512100, win 1416, options [nop,nop,TS val 2162694907 ecr 540011808], length 13032
14:25:14.291981 IP 172.27.17.201.8080 > 192.168.122.239.35366: Flags [P.], seq 2519520788:2519522236, ack 153831537, win 2649, options [nop,nop,TS val 540011811 ecr 2162694907], length 1448
14:25:14.292030 IP 192.168.122.239.35366 > 172.27.17.201.8080: Flags [.], seq 153831537:153883665, ack 2519512100, win 1444, options [nop,nop,TS val 2162694910 ecr 540011808,nop,nop,sack 1 {2519520788:2519522236}], length 52128
14:25:14.292066 IP 192.168.122.239.35366 > 172.27.17.201.8080: Flags [.], seq 153883665:153938233, ack 2519512100, win 1444, options [nop,nop,TS val 2162694910 ecr 540011808,nop,nop,sack 1 {2519520788:2519522236}], length 54568
14:25:14.292075 IP 192.168.122.239.35366 > 172.27.17.201.8080: Flags [.], seq 153938233:153941105, ack 2519512100, win 1444, options [nop,nop,TS val 2162694910 ecr 540011808,nop,nop,sack 1 {2519520788:2519522236}], length 2872
14:25:14.292138 IP 172.27.17.201.8080 > 192.168.122.239.35366: Flags [.], seq 2519512100:2519514996, ack 153831537, win 2649, options [nop,nop,TS val 540011811 ecr 2162694910], length 2896
14:25:14.292159 IP 192.168.122.239.35366 > 172.27.17.201.8080: Flags [.], ack 2519514996, win 1444, options [nop,nop,TS val 2162694910 ecr 540011811,nop,nop,sack 1 {2519520788:2519522236}], length 0
14:25:14.292189 IP 172.27.17.201.8080 > 192.168.122.239.35366: Flags [.], seq 2519514996:2519517892, ack 153941105, win 2212, options [nop,nop,TS val 540011811 ecr 2162694910], length 2896
14:25:14.292205 IP 192.168.122.239.35366 > 172.27.17.201.8080: Flags [.], seq 153941105:153948825, ack 2519517892, win 1444, options [nop,nop,TS val 2162694910 ecr 540011811,nop,nop,sack 1 {2519520788:2519522236}], length 7720
14:25:14.292214 IP 192.168.122.239.35366 > 172.27.17.201.8080: Flags [.], seq 153948825:154006265, ack 2519517892, win 1444, options [nop,nop,TS val 2162694910 ecr 540011811,nop,nop,sack 1 {2519520788:2519522236}], length 57440
14:25:14.292240 IP 172.27.17.201.8080 > 192.168.122.239.35366: Flags [.], seq 2519522236:2519525132, ack 153948825, win 2182, options [nop,nop,TS val 540011811 ecr 2162694910], length 2896
14:25:14.292244 IP 192.168.122.239.35366 > 172.27.17.201.8080: Flags [.], seq 154006265:154013985, ack 2519517892, win 1444, options [nop,nop,TS val 2162694910 ecr 540011811,nop,nop,sack 1 {2519520788:2519522236}], length 7720
14:25:14.292247 IP 192.168.122.239.35366 > 172.27.17.201.8080: Flags [.], seq 154013985:154055629, ack 2519517892, win 1444, options [nop,nop,TS val 2162694910 ecr 540011811,nop,nop,sack 1 {2519520788:2519522236}], length 41644
14:25:14.292258 IP 192.168.122.239.35366 > 172.27.17.201.8080: Flags [.], seq 154055629:154064245, ack 2519517892, win 1444, options [nop,nop,TS val 2162694910 ecr 540011811,nop,nop,sack 1 {2519520788:2519525132}], length 8616
14:25:14.292336 IP 172.27.17.201.8080 > 192.168.122.239.35366: Flags [.], seq 2519517892:2519520788, ack 154055629, win 1748, options [nop,nop,TS val 540011811 ecr 2162694910], length 2896
14:25:14.292342 IP 172.27.17.201.8080 > 192.168.122.239.35366: Flags [.], seq 2519525132:2519526580, ack 154064245, win 1714, options [nop,nop,TS val 540011811 ecr 2162694910], length 1448
